,id,recipeName,rating,totalTimeInSeconds,course,cuisine,ingredients,clean_ingredients,ingredient_count,timeMins,imageURL
101,Croissant-French-Toast-502298,croissant french toast,4.0,2100.0,[Breakfast and Brunch],[American],"[croissants, eggs, half & half, sugar, ground cinnamon, vanilla extract, butter, syrup, strawberries, whipped cream]","['croissant', 'egg', 'half half', 'sugar', 'cinnamon', 'vanilla extract', 'butter', 'syrup', 'strawberry', 'cream']",10,35.0,duckduckgo.com/iu/?u=https%3A%2F%2Ftse1.mm.bing.net%2Fth%3Fid%3DOIP.WhVtYnqjhu50jTWFQSVKawHaLH%26pid%3DApi&f=1&ipt=8405112dab1f74116cda35e615793ec19e1db3f8d126a6b031382adc1a1c34d2&ipo=images
102,Popovers-496888,popovers,0.0,2700.0,"[Breads, Breakfast and Brunch]",[American],"[large eggs, whole milk, all-purpose flour, salt, nonstick spray]","['egg', 'milk', 'all purpose flmy', 'salt', 'nonstick spray']",5,45.0,duckduckgo.com/iu/?u=https%3A%2F%2Ftse1.mm.bing.net%2Fth%3Fid%3DOIP.eDDTsA6tPwJlo7dA-u-vBwHaLH%26pid%3DApi&f=1&ipt=7d42020a064106aa3d760c77b25693d507de1ae32e55e171f09f41fe65622e68&ipo=images
103,Southern-Collard-Greens-Allrecipes,southern collard greens,5.0,11400.0,[Side Dishes],"[Southern & Soul Food, American]","[water, ham hock, collard greens, crushed red pepper flakes, vegetable oil, pepper, salt]","['water', 'ham hock', 'collard', 'pepper flake', 'vegetable oil', 'pepper', 'salt']",7,190.0,duckduckgo.com/iu/?u=https%3A%2F%2Ftse3.mm.bing.net%2Fth%3Fid%3DOIP.UKafu5E5oZevPcW6jEcD1QHaFj%26pid%3DApi&f=1&ipt=2347ce8cc98cfd6d611041627c1477c751af14ae3c2d2fb903c87db7ef54e7ab&ipo=images
104,Chocolate-Chewies-494874,chocolate chewies,4.0,1800.0,[Desserts],[American],"[powdered sugar, unsweetened cocoa powder, dutch-processed cocoa powder, salt, egg whites, vanilla, chopped pecans]","['sugar', 'cocoa powder', 'cocoa powder', 'salt', 'egg white', 'vanilla', 'pecan']",7,30.0,duckduckgo.com/iu/?u=https%3A%2F%2Ftse4.mm.bing.net%2Fth%3Fid%3DOIP.1FM8PXYszXGxcnMIlXobpgHaJ4%26pid%3DApi&f=1&ipt=08d048bab3009c9261c92a6e49f60e5a5bf64f7f6f4f50f0cc7efc89dc7634c1&ipo=images
105,Hash-Browns-Martha-Stewart-196021,hash browns,4.0,2100.0,"[Lunch and Snacks, Side Dishes, Breakfast and Brunch]",[American],"[olive oil, butter, onions, potatoes, pepper, salt]","['olive oil', 'butter', 'onion', 'potato', 'pepper', 'salt']",6,35.0,duckduckgo.com/iu/?u=https%3A%2F%2Ftse3.mm.bing.net%2Fth%3Fid%3DOIP.ZAx8-7LYKqDOxmeJlKdOqAHaLH%26pid%3DApi&f=1&ipt=6614ac5460c0bc61233df0d07fccc4af2bc02accbc4431d51cb600abac9cfdd0&ipo=images
106,Steak-Tacos-with-Guacamole-459374,steak tacos with guacamole,0.0,,[Main Dishes],[American],"[corn tortillas, flank steak, avocado, fresh tomato salsa, lime, freshly ground pepper, romaine lettuce]","['corn tortilla', 'flank steak', 'avocado', 'tomato salsa', 'lime', 'pepper', 'romaine lettuce']",7,,duckduckgo.com/iu/?u=https%3A%2F%2Ftse4.mm.bing.net%2Fth%3Fid%3DOIP.RJmgHIWa3gQlLc3vX5iKawHaKZ%26pid%3DApi&f=1&ipt=1f2f3a0b5b55f26f6da41da3a73487d8bdc9c959795004969f9ed516ac21f389&ipo=images
107,Broccoli-Salad-Jo-Cooks-46082,broccoli salad,5.0,2100.0,"[Lunch and Snacks, Salads, Side Dishes]",[American],"[broccoli, olive oil, rice vinegar, lemon juice, garlic, mustard, salt, pepper, chili flakes]","['broccoli', 'olive oil', 'rice vinegar', 'lemon juice', 'garlic', 'mustard', 'salt', 'pepper', 'chili flake']",9,35.0,duckduckgo.com/iu/?u=https%3A%2F%2Ftse3.mm.bing.net%2Fth%3Fid%3DOIP.DNH004jje3KwODF-bX9P2AHaLC%26pid%3DApi&f=1&ipt=92795717e924db8cabe50966162a70530215dc8f6dc72eea631d2e448cd8181a&ipo=images
108,Mediterranean-potato-_-green-bean-salad-297943,mediterranean potato & green bean salad,4.0,1800.0,"[Salads, Side Dishes]",[American],"[red potato, green beans, wish bone balsam vinaigrett dress, red bell pepper]","['potato', 'bean', 'wish bone balsam vinaigrett dres', 'bell pepper']",4,30.0,duckduckgo.com/iu/?u=https%3A%2F%2Ftse3.mm.bing.net%2Fth%3Fid%3DOIP.enpzRcQm5Z9RCE4tHd6V-wHaJQ%26pid%3DApi&f=1&ipt=d272c11ee99ff12366e8e928760b8f0987154e3ec366cbc9d8169db19db49c02&ipo=images
109,Royal-Icing-459757,royal icing,5.0,,[Desserts],[American],"[egg whites, confectioners sugar, cream of tartar, salt, fresh lemon juice]","['egg white', 'confectioner sugar', 'cream tartar', 'salt', 'lemon juice']",5,,duckduckgo.com/iu/?u=https%3A%2F%2Ftse2.mm.bing.net%2Fth%3Fid%3DOIP.W96wmJFqbJjHgWmjteDCcwHaIS%26pid%3DApi&f=1&ipt=98473a587a9ab0ebfff03d55cf61e93f4f8d73cce6f5adaecb7f74864ee4dcec&ipo=images
110,Zucchini-tots-352258,zucchini tots,5.0,,,[American],"[zucchini, large eggs, onions, reduced fat sharp cheddar cheese, bread crumbs, pepper, salt, cooking spray]","['zucchini', 'egg', 'onion', 'dar cheese', 'bread crumb', 'pepper', 'salt', 'cooking spray']",8,,duckduckgo.com/iu/?u=https%3A%2F%2Ftse4.mm.bing.net%2Fth%3Fid%3DOIP.QPTrP2khu38xgdu4r4zwTgHaLJ%26pid%3DApi&f=1&ipt=591dc43a50d6adc56fb091cf8d2d4f7055b2b8046dea7cddabaa05f8dc6e3b7d&ipo=images
111,Baked-vidalia-onion-dip-300019,baked vidalia onion dip,4.0,2100.0,[Appetizers],"[American, Southern & Soul Food]","[onions, grated parmesan cheese, hellmann' or best food real mayonnais, garlic, hot pepper sauce]","['onion', 'parmesan cheese', 'hellmann best food real mayonnai', 'garlic', 'hot pepper sauce']",5,35.0,duckduckgo.com/iu/?u=https%3A%2F%2Ftse1.mm.bing.net%2Fth%3Fid%3DOIP.9VvLT0u3r9-43-uv9lmHkAHaE8%26pid%3DApi&f=1&ipt=ebb1b084cff984e93a9ffafd7b4d63fc7804a28638fa6e50aba84f628e70da50&ipo=images
112,Crawfish-Cornbread-1344372,crawfish cornbread,4.0,5100.0,[Breads],[Southern & Soul Food],"[yellow corn meal, baking powder, salt, creole seasoning, eggs, vegetable oil, yellow onion, cheddar cheese, frozen corn, crawfish, jalapeno chilies]","['yellow corn meal', 'baking powder', 'salt', 'creole seasoning', 'egg', 'vegetable oil', 'yellow onion', 'dar cheese', 'corn', 'crawfish', 'jalapeno chily']",11,85.0,duckduckgo.com/iu/?u=https%3A%2F%2Ftse3.mm.bing.net%2Fth%3Fid%3DOIP.AvniJQDQyshkfXpfnXSwTAHaHa%26pid%3DApi&f=1&ipt=0ad63883ca4bd962788358a13750393d525ed3a5fce546d2cd18360b58ed94fa&ipo=images
113,Lemon-Curd-Tart-459436,lemon curd tart,5.0,,[Desserts],[American],"[rolls, eggs, sugar, fresh lemon juice, grated lemon zest, unsalted butter, cream sweeten whip]","['roll', 'egg', 'sugar', 'lemon juice', 'lemon zest', 'butter', 'cream sweeten whip']",7,,duckduckgo.com/iu/?u=https%3A%2F%2Ftse1.mm.bing.net%2Fth%3Fid%3DOIP.SIkJYgVQzC8YXt4eWD1cbwHaF6%26pid%3DApi&f=1&ipt=667078755723fae00bad44942662e3af62c44e371112fc6e6f47e46ecb34a34b&ipo=images
114,Best-Ever-Pasta-Salad-Allrecipes,best ever pasta salad,4.0,2100.0,[Salads],[American],"[penne pasta, cucumber, plum tomatoes, mayonnaise, sour cream, dried dillweed, lemon pepper]","['penne pastum', 'cucumber', 'plum tomato', 'mayonnaise', 'smy cream', '', 'lemon pepper']",7,35.0,duckduckgo.com/iu/?u=https%3A%2F%2Ftse2.mm.bing.net%2Fth%3Fid%3DOIP.wz0uykctlP5AGMj0TYKWxAHaLG%26pid%3DApi&f=1&ipt=1688c866e90f9b9f13358eb5ffd150f096aa17d77e8500fd231086b38cb9c18a&ipo=images
115,Mashed-sweet-potatoes-brulee-352040,mashed sweet potatoes brulee,5.0,,[Side Dishes],[American],"[sweet potatoes, 1% low-fat milk, butter, salt, ground cinnamon, ground nutmeg, light brown sugar]","['sweet potato', 'low fat milk', 'butter', 'salt', 'cinnamon', 'nutmeg', 'light brown sugar']",7,,duckduckgo.com/iu/?u=https%3A%2F%2Ftse4.mm.bing.net%2Fth%3Fid%3DOIP.P3um2X3ehY9ukOvls2N_9wHaLH%26pid%3DApi&f=1&ipt=bbc2bd596ddd8f8570ed8e87f8e02da7365cf60890a9f4483345f89725436b73&ipo=images
116,Dill-Sauce-Allrecipes,dill sauce,4.0,300.0,[Condiments and Sauces],[American],"[sour cream, dijon, lemon juice, fresh dill]","['smy cream', 'dijon', 'lemon juice', 'dill']",4,5.0,duckduckgo.com/iu/?u=https%3A%2F%2Ftse3.mm.bing.net%2Fth%3Fid%3DOIP.5yzOEtcXl8IZ2SCsTW7qwgHaHa%26pid%3DApi&f=1&ipt=1274e2225a7b70ba198c7bd85305c299970facafe39af2e0dfd6a20c79ee6caf&ipo=images
117,Prize-Winning-Baby-Back-Ribs-Allrecipes,prize winning baby back ribs,5.0,5700.0,[Main Dishes],"[Barbecue, Southwestern, American]","[ground cumin, chili powder, paprika, pepper, salt, pork baby back ribs, barbecue sauce]","['cumin', 'chili powder', 'paprika', 'pepper', 'salt', 'pork baby rib', 'barbecue sauce']",7,95.0,duckduckgo.com/iu/?u=https%3A%2F%2Ftse4.mm.bing.net%2Fth%3Fid%3DOIP.vSIFF6MbS1uCTZDv2YInmQHaHa%26pid%3DApi&f=1&ipt=0eed433e35d8b98aa9eda182f4f05947009b349f2da647bb4a5bf085d17c2233&ipo=images
118,Artichokes-Allrecipes,artichokes,4.0,1500.0,,[American],"[artichokes, butter, garlic, pepper, salt]","['artichoke', 'butter', 'garlic', 'pepper', 'salt']",5,25.0,duckduckgo.com/iu/?u=https%3A%2F%2Ftse1.mm.bing.net%2Fth%3Fid%3DOIP.DZMDGXqAggrD-a_96E5DEQHaE8%26pid%3DApi&f=1&ipt=5539fc4169f51f92362f62204e31f63792c9168db256448657f8aceab6a996e8&ipo=images
119,Roasted-Carrots-with-Dill-540002,roasted carrots with dill,4.0,,[Side Dishes],[American],"[carrots, olive oil, dill, kosher salt, pepper, cooking oil]","['carrot', 'olive oil', 'dill', 'kosher salt', 'pepper', 'cooking oil']",6,,duckduckgo.com/iu/?u=https%3A%2F%2Ftse1.mm.bing.net%2Fth%3Fid%3DOIP.YR-RnqVyN-1k--MuEEPY2gHaLH%26pid%3DApi&f=1&ipt=f369484483662d7d511897edb07ab8993daa2846e1951aeda55e370a8a2e86b8&ipo=images
120,Cranberry-Sauce-Closet-Cooking-58308,cranberry sauce,5.0,1800.0,"[Condiments and Sauces, Side Dishes]",[American],"[cranberries, water, sugar]","['cranberry', 'water', 'sugar']",3,30.0,duckduckgo.com/iu/?u=https%3A%2F%2Ftse1.mm.bing.net%2Fth%3Fid%3DOIP.HTmZMzeewaRKWME3F7ZEEQHaLF%26pid%3DApi&f=1&ipt=d05c23d9fc5ee2522a61985fbd0bd3c4feef3ea49e569df1bce21407be5a56c4&ipo=images
121,Banana-pudding-369019,banana pudding,5.0,1500.0,[Desserts],"[American, Southern & Soul Food]","[egg yolks, sugar, corn starch, whole milk, vanilla, butter, bananas, cooki vanilla wafer, heavy cream, powdered sugar]","['egg yolk', 'sugar', 'corn starch', 'milk', 'vanilla', 'butter', 'banana', 'cooki vanilla wafer', 'heavy cream', 'sugar']",10,25.0,duckduckgo.com/iu/?u=https%3A%2F%2Ftse4.mm.bing.net%2Fth%3Fid%3DOIP.5allfe1HMgwxHWAuFHTXxAAAAA%26pid%3DApi&f=1&ipt=bc8fef6261ba69a8bd8ed9151723a84f83aa2755d3e93f122757f98a020090d2&ipo=images
122,Homemade-Chocolate-Peanut-Butter-484132,homemade chocolate peanut butter,4.0,600.0,[Desserts],[American],"[honey roasted peanuts, vanilla extract, semi-sweet chocolate morsels, salt]","['peanut', 'vanilla extract', 'semi sweet chocolate morsel', 'salt']",4,10.0,duckduckgo.com/iu/?u=https%3A%2F%2Ftse4.mm.bing.net%2Fth%3Fid%3DOIP.1HK_EMC6pE7SJ8_pxHcpkQHaLG%26pid%3DApi&f=1&ipt=aa136256e91722ea78a1b275ebc780aa978a0973949e420df698b7f48acabb8b&ipo=images
123,Caramelized-Onion-Chicken-Soup-485776,caramelized onion chicken soup,4.0,3300.0,[Soups],[American],"[onions, garlic, cooked chicken, chicken stock, kosher salt]","['onion', 'garlic', 'chicken', 'chicken stock', 'kosher salt']",5,55.0,duckduckgo.com/iu/?u=https%3A%2F%2Ftse4.mm.bing.net%2Fth%3Fid%3DOIP.G58JjCkDi1FapPmzex_0PgHaHa%26pid%3DApi&f=1&ipt=a85a5afd8befab7221df97bdbf9e2b33eb437e9dc7bd9cca68ad355c72b79216&ipo=images
124,Smothered-Potatoes-Allrecipes,smothered potatoes,4.0,2400.0,[Side Dishes],[American],"[red potato, pepper, salt, all-purpose flour, onions, vegetable oil, water]","['potato', 'pepper', 'salt', 'all purpose flmy', 'onion', 'vegetable oil', 'water']",7,40.0,duckduckgo.com/iu/?u=https%3A%2F%2Ftse1.mm.bing.net%2Fth%3Fid%3DOIP.XKx6TYx5b3kLPcPz9N0VogHaLH%26pid%3DApi&f=1&ipt=9f8e782426952b9b07d485c3c8f20afc63088264a953e3e7b3c5f92ea7563992&ipo=images
125,Southern-Fried-Cabbage-Allrecipes,southern fried cabbage,5.0,900.0,[Side Dishes],"[Southern & Soul Food, American]","[bacon, vegetable oil, salt, ground black pepper, cabbage, white onion, white sugar]","['bacon', 'vegetable oil', 'salt', 'black pepper', 'cabbage', 'white onion', 'white sugar']",7,15.0,duckduckgo.com/iu/?u=https%3A%2F%2Ftse4.mm.bing.net%2Fth%3Fid%3DOIP.TKRbYcLQy1fNQkzFOhulHQHaHa%26pid%3DApi&f=1&ipt=51683348ccbec2037c1104b8410ff1d8199c60662a8dbcb0a2d507779c2e85ac&ipo=images
126,Pineapple-Upside-Down-Cake-471486,pineapple upside down cake,5.0,2100.0,[Desserts],[American],"[yellow cake mix, pineapple slices, margarine, cherries, brown sugar]","['yellow cake mix', 'pineapple slice', 'margarine', 'cherry', 'brown sugar']",5,35.0,duckduckgo.com/iu/?u=https%3A%2F%2Ftse3.mm.bing.net%2Fth%3Fid%3DOIP.ff2M1edoUrBfLAdUd36dPQHaLH%26pid%3DApi&f=1&ipt=4731f1bb3eff5daeaa80ae4831d7dea505bf3571a9c0f4152cdb122652750693&ipo=images
127,Baby-red-potato-salad-351963,baby red potato salad,5.0,,[Salads],[American],"[red potato, green bell pepper, purple onion, scallions, dijon mustard, extra-virgin olive oil, red wine vinegar, reduced fat mayonnaise, salt, pepper]","['potato', 'bell pepper', 'purple onion', 'scallion', 'dijon mustard', 'extra virgin olive oil', 'wine vinegar', 'fat mayonnaise', 'salt', 'pepper']",10,,duckduckgo.com/iu/?u=https%3A%2F%2Ftse2.mm.bing.net%2Fth%3Fid%3DOIP._pTWFy_hPjIxBuc35c0OJgHaLH%26pid%3DApi&f=1&ipt=b565033060a13ee3703841d49f8d1efbd88be220ad7021a1a7d419312a801176&ipo=images
128,Turkey-Club-Sandwich-512518,turkey club sandwich,5.0,,[Lunch and Snacks],[American],"[white sandwich bread, mayonnaise, turkey breast, thick-cut bacon, tomatoes, lettuce]","['white sandwich bread', 'mayonnaise', 'turkey breast', 'thick cut bacon', 'tomato', 'lettuce']",6,,duckduckgo.com/iu/?u=https%3A%2F%2Ftse3.mm.bing.net%2Fth%3Fid%3DOIP.Cw-C6Ygc4csQ1tWgWB0yfwHaHa%26pid%3DApi&f=1&ipt=d59b04a08640c4c3406372d73fbb3f858c6d4b34fd3997ae11f45ef70919f601&ipo=images
129,Garlic-fries-347061,garlic fries,5.0,,"[Appetizers, Lunch and Snacks, Side Dishes]",[American],"[french fries, vegetable oil, garlic, finely chopped fresh parsley, salt]","['french fry', 'vegetable oil', 'garlic', 'parsley', 'salt']",5,,duckduckgo.com/iu/?u=https%3A%2F%2Ftse1.mm.bing.net%2Fth%3Fid%3DOIP.8p2y0k1MGyWwTK2sR4n6fgHaLH%26pid%3DApi&f=1&ipt=0ec0de3d7e3eea1bffc0cb25d64be00e01d61960a0912c5a9a3a4ea4edc55162&ipo=images
130,Grilled-Cheese-Sandwich-Allrecipes,grilled cheese sandwich,5.0,1200.0,[Lunch and Snacks],[American],"[white bread, butter, cheddar cheese]","['white bread', 'butter', 'dar cheese']",3,20.0,duckduckgo.com/iu/?u=https%3A%2F%2Ftse1.mm.bing.net%2Fth%3Fid%3DOIP.I7yuDdwsXGnlVrJd9PHI7gHaJl%26pid%3DApi&f=1&ipt=3420f25ce786ea99af6d874d8b99ec3c959488bc11e1d34a4a9c881278005c42&ipo=images
131,Grilled-buffalo-chicken-pizza-303144,grilled buffalo chicken pizza,4.0,1500.0,[Main Dishes],[American],"[prebaked pizza crusts, ragu organic pasta sauc, buffalo chicken strip style, celery, shredded mozzarella cheese, blue cheese]","['pizza crust', 'ragu organic pastum sauc', 'buffalo chicken strip style', 'celery', 'mozzarella cheese', 'blue cheese']",6,25.0,duckduckgo.com/iu/?u=https%3A%2F%2Ftse4.mm.bing.net%2Fth%3Fid%3DOIP.NsafLRcb9aFgHb-c2O649AHaJQ%26pid%3DApi&f=1&ipt=a6e7b8efefcf45e18eac5ebd18301e2d0badbf689892128ddf1d158c59eaea1f&ipo=images
132,Pineapple-Limeade-Cooler-488571,pineapple limeade cooler,4.0,600.0,[Beverages],[American],"[pineapple juice, limeade, sierra mist, ice, lime wedges, mint leaves]","['pineapple juice', 'limeade', 'sierra mist', 'ice', 'ge', 'mint leaf']",6,10.0,duckduckgo.com/iu/?u=https%3A%2F%2Ftse4.mm.bing.net%2Fth%3Fid%3DOIP.RhqMDlTZUR2fm55mE6Bo3AAAAA%26pid%3DApi&f=1&ipt=02221744dce0c18ab6d110074f22191fdedb6fe61f4cd8935149f91780684c6f&ipo=images
133,Creamy-macaroni-and-cheese-368517,creamy macaroni and cheese,5.0,2400.0,"[Main Dishes, Side Dishes]","[American, Kid-Friendly]","[elbow macaroni, salt, butter, flour, milk, monterey jack, cheddar cheese]","['elbow macaroni', 'salt', 'butter', 'flmy', 'milk', 'monterey jack', 'dar cheese']",7,40.0,duckduckgo.com/iu/?u=https%3A%2F%2Ftse3.mm.bing.net%2Fth%3Fid%3DOIP.EXCzjes9tBqqFUPkW09LcwHaLH%26pid%3DApi&f=1&ipt=835eba9f97c1b40e9fef6245fb99fe472d1d4aa46764ca7bf39aca22780d5cd7&ipo=images
134,Easy-Chicken-Pot-Pie-MyRecipes-211512,easy chicken pot pie,4.0,4200.0,[Main Dishes],[American],"[refrigerated piecrusts, chicken, mixed vegetables, cream of chicken soup, celery flakes, pepper, poultry seasoning]","['piecrust', 'chicken', 'vegetable', 'cream chicken soup', 'celery flake', 'pepper', 'poultry seasoning']",7,70.0,duckduckgo.com/iu/?u=https%3A%2F%2Ftse3.mm.bing.net%2Fth%3Fid%3DOIP.h4IJEb1Uvc7bOnMsrBSRZAHaLH%26pid%3DApi&f=1&ipt=a19bc50a407a52aed53dfaaeb44bae30b394036f2d458419444b4d75b2a92ebf&ipo=images
135,Marmalade--and-Ginger-glazed-Sweet-Potatoes-1374381,marmalade- and ginger-glazed sweet potatoes,3.0,5100.0,[Side Dishes],[American],"[sweet potatoes, orange, orange marmalade, brandy, butter, crystallized ginger, salt]","['sweet potato', 'orange', 'orange marmalade', 'brandy', 'butter', 'ginger', 'salt']",7,85.0,duckduckgo.com/iu/?u=https%3A%2F%2Ftse3.mm.bing.net%2Fth%3Fid%3DOIP.IfyP6ipc9TpyNAsTPnBK_gHaFj%26pid%3DApi&f=1&ipt=99f1029ff20eea1f1dd302c898f9ba9384774c6136851ed990be6da0dcc4783b&ipo=images
136,Smoky-Paprika-BBQ-Potato-Chips-513498,smoky paprika bbq potato chips,5.0,1200.0,,[American],"[potato chips, turbinado, sea salt, paprika, garlic powder]","['potato chip', 'turbinado', 'sea salt', 'paprika', 'garlic powder']",5,20.0,duckduckgo.com/iu/?u=https%3A%2F%2Ftse2.mm.bing.net%2Fth%3Fid%3DOIP.ICQ4ssDXy69SfhGKvVitAgHaI4%26pid%3DApi&f=1&ipt=a0ff58fda380d33ee31339054275706c2378891e27f62a91bdec9cfe73f3b3c2&ipo=images
137,Garlic-Fries-457681,garlic fries,5.0,,"[Appetizers, Lunch and Snacks, Side Dishes]",[American],"[baking potatoes, vegetable oil, salt, garlic cloves, flat leaf parsley]","['baking potato', 'vegetable oil', 'salt', 'garlic clove', 'flat leaf parsley']",5,,duckduckgo.com/iu/?u=https%3A%2F%2Ftse1.mm.bing.net%2Fth%3Fid%3DOIP.8p2y0k1MGyWwTK2sR4n6fgHaLH%26pid%3DApi&f=1&ipt=0ec0de3d7e3eea1bffc0cb25d64be00e01d61960a0912c5a9a3a4ea4edc55162&ipo=images
138,Grapefruit-sorbet-333226,grapefruit sorbet,5.0,28800.0,[Desserts],[American],"[grapefruit juice, granulated sugar]","['grapefruit juice', 'sugar']",2,480.0,duckduckgo.com/iu/?u=https%3A%2F%2Ftse4.mm.bing.net%2Fth%3Fid%3DOIP.0kHjBIMCNsd0_C9Zv5CADQHaKs%26pid%3DApi&f=1&ipt=b750a22a07dcedd78c1447958b6d3ae65a2ad3e497831434b23896cfdb6a3a51&ipo=images
139,Strawberry-mango-basil-salsa-333727,strawberry mango basil salsa,5.0,3000.0,[Condiments and Sauces],[American],"[mango, strawberries, purple onion, fresh basil leaves, lemon juice, sea salt, black pepper]","['mango', 'strawberry', 'purple onion', 'basil leaf', 'lemon juice', 'sea salt', 'black pepper']",7,50.0,duckduckgo.com/iu/?u=https%3A%2F%2Ftse4.mm.bing.net%2Fth%3Fid%3DOIP.4GWdt4eFceRGzKEEdQMVcwHaKl%26pid%3DApi&f=1&ipt=2e75634c1ad90fb72bcdf35320ea44d59408cc5029af9d90fa389ab20d2cc04e&ipo=images
140,Jambalaya-with-White-Quinoa-1368921,jambalaya with white quinoa,4.0,3900.0,[Main Dishes],[Cajun & Creole],"[andouille sausage, onions, green bell pepper, red bell pepper, celery, diced tomatoes, chicken stock, dried oregano, dried thyme, cajun seasoning, hot sauce, worcestershire sauce, bay leaves, kosher salt, ground pepper, shrimp, quinoa]","['andouille sausage', 'onion', 'bell pepper', 'bell pepper', 'celery', 'tomato', 'chicken stock', 'oregano', 'thyme', 'cajun seasoning', 'hot sauce', 'worcestershire sauce', 'bay leaf', 'kosher salt', 'pepper', 'shrimp', 'quinoa']",17,65.0,duckduckgo.com/iu/?u=https%3A%2F%2Ftse1.mm.bing.net%2Fth%3Fid%3DOIP.gSRAJniSIkUhiDMNQfv9PQHaKc%26pid%3DApi&f=1&ipt=d7c7fd899c840fc90151c56438eadfb9099afac6eded1e73f016c80f96a55879&ipo=images
141,Apple-Cider-Vinaigrette-513655,apple cider vinaigrette,5.0,300.0,[Salads],[American],"[apple juice, apple cider vinegar, kosher salt, cracked black pepper, extra-virgin olive oil]","['apple juice', 'apple cider vinegar', 'kosher salt', 'black pepper', 'extra virgin olive oil']",5,5.0,duckduckgo.com/iu/?u=https%3A%2F%2Ftse1.mm.bing.net%2Fth%3Fid%3DOIP.G_d8JYfCix7lOanwsB-k8AHaLH%26pid%3DApi&f=1&ipt=e89082518b50b2fd54367868225388e77120aa445c2606ccfd5acbfdf1003b04&ipo=images
142,Kentucky-hot-brown-bake-365176,kentucky hot brown bake,5.0,900.0,[Main Dishes],"[American, Southern & Soul Food]","[refrigerated crescent rolls, meat, cooked bacon, swiss cheese, roma tomatoes, eggs]","['crescent roll', 'meat', 'bacon', 'swiss cheese', 'roma tomato', 'egg']",6,15.0,duckduckgo.com/iu/?u=https%3A%2F%2Ftse4.mm.bing.net%2Fth%3Fid%3DOIP.e3wMkL61BJ3CeB41Es1A2wHaHa%26pid%3DApi&f=1&ipt=1e9caba9a914f3c99e4a73eb5df20ece8e0263a62e34199bb97aa0ebaedfabfc&ipo=images
143,Orange-Banana-Smoothie-Allrecipes,orange banana smoothie,4.0,300.0,[Beverages],[American],"[cold milk, orange, bananas, sugar, salt, fat free yogurt, ice]","['cold milk', 'orange', 'banana', 'sugar', 'salt', 'fat free yogurt', 'ice']",7,5.0,duckduckgo.com/iu/?u=https%3A%2F%2Ftse4.mm.bing.net%2Fth%3Fid%3DOIP.JXDGF_8If6blyNf2bNzipQHaJ4%26pid%3DApi&f=1&ipt=d59dba3c513be2c23eec925e274d69e843b5b55dc6b115203dcf1f71eaf82aa9&ipo=images
144,All_purpose-Rub-For-Meat-Allrecipes,all-purpose rub for meat,4.0,300.0,,"[Barbecue, American]","[white sugar, salt, paprika, mustard powder, ground black pepper, dried oregano, dried thyme]","['white sugar', 'salt', 'paprika', 'mustard powder', 'black pepper', 'oregano', 'thyme']",7,5.0,duckduckgo.com/iu/?u=https%3A%2F%2Ftse4.mm.bing.net%2Fth%3Fid%3DOIP.huvuuFkbkCs3BLfdX8gWogHaFj%26pid%3DApi&f=1&ipt=50aec0d5478f5fe0828ee663dbfd5e9841a1f8f0b730d3ad9bee184996d3c90d&ipo=images
145,Broccolini-salad-308618,broccolini salad,5.0,1500.0,[Salads],[American],"[baby broccoli, scallions, pepper, extra-virgin olive oil, salt, croutons, fresh lemon juice, sliced almonds, chees fresh mozzarella]","['baby broccoli', 'scallion', 'pepper', 'extra virgin olive oil', 'salt', 'crouton', 'lemon juice', 'almond', 'chee mozzarella']",9,25.0,duckduckgo.com/iu/?u=https%3A%2F%2Ftse2.mm.bing.net%2Fth%3Fid%3DOIP.PTEhy_ZpogFztZQsTSmIogHaLH%26pid%3DApi&f=1&ipt=551a9f6e02f4fdd3397c6a454f16a571dd8a8985fe88c2d6a13c7f2362f13faf&ipo=images
146,Chipotle-Dry-Rub-AllRecipes,chipotle dry rub,5.0,300.0,,"[American, Mexican]","[brown sugar, chipotle peppers, paprika, mustard powder, ground cumin, salt]","['brown sugar', 'chipotle pepper', 'paprika', 'mustard powder', 'cumin', 'salt']",6,5.0,duckduckgo.com/iu/?u=https%3A%2F%2Ftse3.mm.bing.net%2Fth%3Fid%3DOIP.eeVRamh3klEal_EgUP6QHQHaHa%26pid%3DApi&f=1&ipt=c5114867333ea9925b29227af7a1b9fd596486464a7fca4667a0eeee5522c5e1&ipo=images
147,Grilled-zucchini-and-tomato-salad-352591,grilled zucchini and tomato salad,5.0,1500.0,,[American],"[zucchini, tomatoes, cooking spray, kosher salt, ground black pepper, fresh parsley]","['zucchini', 'tomato', 'cooking spray', 'kosher salt', 'black pepper', 'parsley']",6,25.0,duckduckgo.com/iu/?u=https%3A%2F%2Ftse2.mm.bing.net%2Fth%3Fid%3DOIP.CeIYuMjTdivkxE84XHBu4QHaJI%26pid%3DApi&f=1&ipt=050c23ecb611aa30bef8cfe8d0bae7fb136239c14309909fccd935e3b7b40e8d&ipo=images
148,Cauliflower-Puree-Martha-Stewart-259686,cauliflower puree,3.0,2400.0,[Side Dishes],[American],"[cauliflower, coarse salt, ground pepper, low sodium chicken broth, extra-virgin olive oil]","['cauliflower', 'coarse salt', 'pepper', 'low sodium chicken broth', 'extra virgin olive oil']",5,40.0,duckduckgo.com/iu/?u=https%3A%2F%2Ftse4.mm.bing.net%2Fth%3Fid%3DOIP.T1frM0omJDqWLXlAPPqgzgHaI-%26pid%3DApi&f=1&ipt=8b7ac59cc7e6490cba1ea9f47f92b2ee21cd54fadca56d84a5ee71272974a1e5&ipo=images
149,Twice_Baked-Potatoes-Martha-Stewart_1,twice-baked potatoes,4.0,7200.0,"[Lunch and Snacks, Side Dishes]",[American],"[russet potatoes, milk, unsalted butter, sour cream, sharp cheddar cheese, freshly ground pepper, coarse salt, chopped fresh chives]","['russet potato', 'milk', 'butter', 'smy cream', 'dar cheese', 'pepper', 'coarse salt', 'chive']",8,120.0,duckduckgo.com/iu/?u=https%3A%2F%2Ftse3.mm.bing.net%2Fth%3Fid%3DOIP.7ieGEnCsQfXdFSOSst8I7gHaLH%26pid%3DApi&f=1&ipt=444ec6058dfb03d301989ffc0534cb5026208a6a0fae5c87e810cd729f7e162a&ipo=images
150,Parker-House-Rolls-Martha-Stewart-238734,parker house rolls,5.0,10200.0,[Breads],[American],"[whole milk, active dry yeast, all-purpose flour, unsalted butter, coarse salt, sugar, nonstick spray]","['milk', 'active dry yeast', 'all purpose flmy', 'butter', 'coarse salt', 'sugar', 'nonstick spray']",7,170.0,duckduckgo.com/iu/?u=https%3A%2F%2Ftse2.mm.bing.net%2Fth%3Fid%3DOIP.RHaRAe-M5UuUh_KTOpKKrQHaJS%26pid%3DApi&f=1&ipt=9d0ec171a7b5defca68639e379ebbd2e5fb836691846ab0ff975abfb1abe04ee&ipo=images
151,Strawberry-lemonade-368973,strawberry lemonade,5.0,1500.0,[Beverages],"[American, Southern & Soul Food]","[sugar, water, lemon, strawberries, fresh lemon juice, ice cubes]","['sugar', 'water', 'lemon', 'strawberry', 'lemon juice', 'ice cube']",6,25.0,duckduckgo.com/iu/?u=https%3A%2F%2Ftse2.mm.bing.net%2Fth%3Fid%3DOIP.4zNEt-QmguY72vtOwp-k1wHaLH%26pid%3DApi&f=1&ipt=c63b9b1b2c6d76c6a3face3a05b4ba611aec695b9f180bec83080eb6095075fd&ipo=images
152,Vanilla-Pound-Cake-Martha-Stewart,vanilla pound cake,4.0,4500.0,[Desserts],[American],"[unsalted butter, all-purpose flour, sugar, large eggs, pure vanilla extract, salt]","['butter', 'all purpose flmy', 'sugar', 'egg', 'pure vanilla extract', 'salt']",6,75.0,duckduckgo.com/iu/?u=https%3A%2F%2Ftse4.mm.bing.net%2Fth%3Fid%3DOIP.odYJOnMD_ae67Tcvo77nEAHaLH%26pid%3DApi&f=1&ipt=5526b3849bbee602a71c09584cc9541f5ff8f0fd83f2bb95060d717b73351182&ipo=images
153,Homemade-cajun-french-fries-334991,homemade cajun french fries,5.0,,,"[American, Kid-Friendly]","[oil, cajun seasoning, smoked paprika, kosher salt, ground black pepper, garlic powder, dried oregano, russet potatoes, water, cold water, granulated sugar]","['oil', 'cajun seasoning', 'paprika', 'kosher salt', 'black pepper', 'garlic powder', 'oregano', 'russet potato', 'water', 'cold water', 'sugar']",11,,duckduckgo.com/iu/?u=https%3A%2F%2Ftse1.mm.bing.net%2Fth%3Fid%3DOIP.cOrNAR9JW-_U-sVdWqcH6gHaHa%26pid%3DApi&f=1&ipt=4c70676556f2568b171acb377eb786edac6b0bced8105ec97cc9f910307a1bef&ipo=images
