,id,recipeName,rating,totalTimeInSeconds,course,cuisine,ingredients,clean_ingredients,ingredient_count,timeMins,imageURL
154,Slow-Roasted-Tomato-BLT-Closet-Cooking-54887,slow roasted tomato blt,5.0,,,[American],"[bread, lettuce, roma tomatoes, bacon, pesto, mayonnaise, plum tomatoes, olive oil, thyme, pepper, salt]","['bread', 'lettuce', 'roma tomato', 'bacon', 'pesto', 'mayonnaise', 'plum tomato', 'olive oil', 'thyme', 'pepper', 'salt']",11,,duckduckgo.com/iu/?u=https%3A%2F%2Ftse4.mm.bing.net%2Fth%3Fid%3DOIP.KWqJOh5tCB8_SFCPtyY0uwAAAA%26pid%3DApi&f=1&ipt=e4510b100a7e20a82fb6931132ccf3a99a6506e1c81da0732c289cba0f6c44ad&ipo=images
155,Classic-Pound-Cake-Martha-Stewart_1,classic pound cake,4.0,5100.0,[Desserts],[American],"[unsalted butter, all-purpose flour, salt, granulated sugar, pure vanilla extract, large eggs]","['butter', 'all purpose flmy', 'salt', 'sugar', 'pure vanilla extract', 'egg']",6,85.0,duckduckgo.com/iu/?u=https%3A%2F%2Ftse1.mm.bing.net%2Fth%3Fid%3DOIP.8_ORPUaLzUFSkgdOQU9LawHaHa%26pid%3DApi&f=1&ipt=9c04d4c03d7d7f00a7c8732e74e066da1da4aeca3f083337fbecd204fcca0bd2&ipo=images
156,Waldorf-Salad-482080,waldorf salad,4.0,900.0,"[Lunch and Snacks, Salads, Side Dishes]",[American],"[apples, red grape, chopped celery, chopped walnuts, lemon juice, mayonnaise, lettuce]","['apple', 'grape', 'celery', 'walnut', 'lemon juice', 'mayonnaise', 'lettuce']",7,15.0,duckduckgo.com/iu/?u=https%3A%2F%2Ftse3.mm.bing.net%2Fth%3Fid%3DOIP.xlcMdpXQpuOhmCE3zrgyAQHaLH%26pid%3DApi&f=1&ipt=a0342ecdf47d7595dae42d6606fc18511ee7c5c14a8b07d925ff7c1aaba6fcf7&ipo=images
157,Strawberry-Hemp-Granola-Naturally-Ella-46510,strawberry hemp granola,5.0,4500.0,[Breakfast and Brunch],[American],"[oats, hemp seeds, honey, sunflower oil, orange juice, vanilla, dried strawberries]","['oat', '', 'honey', 'sunflower oil', 'orange juice', 'vanilla', 'strawberry']",7,75.0,duckduckgo.com/iu/?u=https%3A%2F%2Ftse2.mm.bing.net%2Fth%3Fid%3DOIP.yKxR0o4rGtt85eHNZ6RECQHaLG%26pid%3DApi&f=1&ipt=28cf2d9f43cc30805bd180423f398ff1a700fcbcb20c93ea03fb3da1c64f7e95&ipo=images
158,Peach-Cobbler-TasteOfHome,peach cobbler,4.0,2400.0,[Desserts],"[American, Southern & Soul Food]","[butter, peaches, sugar, all-purpose flour, milk, baking powder, salt]","['butter', 'peach', 'sugar', 'all purpose flmy', 'milk', 'baking powder', 'salt']",7,40.0,duckduckgo.com/iu/?u=https%3A%2F%2Ftse2.mm.bing.net%2Fth%3Fid%3DOIP.03G30RM0Emv3cSlyZV09oQHaFS%26pid%3DApi&f=1&ipt=8cd56ab827e84567ac1b38d7c78abc76fd3b6e53bf255ed1365edbdd507d66e0&ipo=images
159,Chocolate_Raspberry-Tart-Martha-Stewart,chocolate-raspberry tart,4.0,3600.0,[Desserts],[American],"[chocolate wafer cookies, sugar, coarse salt, unsalted butter, semi-sweet chocolate morsels, heavy cream, fresh raspberries]","['chocolate wafer cookie', 'sugar', 'coarse salt', 'butter', 'semi sweet chocolate morsel', 'heavy cream', 'raspberry']",7,60.0,duckduckgo.com/iu/?u=https%3A%2F%2Ftse1.mm.bing.net%2Fth%3Fid%3DOIP.VuPJOJvOrXspIeDeifZ0GgHaLG%26pid%3DApi&f=1&ipt=0653c4f869757eb09955571f4dbf9942646107f6a9ef85f349b1d76f83b0e31d&ipo=images
160,Honey-Glazed-Chicken-Martha-Stewart-195421,honey-glazed chicken,5.0,1800.0,[Main Dishes],"[Barbecue, American]","[honey, balsamic vinegar, dried thyme, coarse salt, ground pepper, chicken]","['honey', 'balsamic vinegar', 'thyme', 'coarse salt', 'pepper', 'chicken']",6,30.0,duckduckgo.com/iu/?u=https%3A%2F%2Ftse1.mm.bing.net%2Fth%3Fid%3DOIP.FSCVH21ApRL74ETL-2A6BAHaKQ%26pid%3DApi&f=1&ipt=0b357abb8eac5ce2b111f9ebcace2c661ace350e8ff371d67290dc3145e9ff12&ipo=images
161,Mint-Lemonade-Martha-Stewart,mint lemonade,5.0,1800.0,[Beverages],[American],"[sugar, ice cubes, lemon juice, mint, lemon]","['sugar', 'ice cube', 'lemon juice', 'mint', 'lemon']",5,30.0,duckduckgo.com/iu/?u=https%3A%2F%2Ftse4.mm.bing.net%2Fth%3Fid%3DOIP.sM5xKLm1eOACc5q4qeCfgQHaJ4%26pid%3DApi&f=1&ipt=035b4c0b2903d94ac584010038a918655da2f34176c11547634edd8286e9884e&ipo=images
162,Beef-barley-soup-352595,beef barley soup,5.0,,[Soups],[American],"[oil, meat, carrots, onions, chopped celery, garlic, water, kosher salt, bay leaves, barley, ground black pepper]","['oil', 'meat', 'carrot', 'onion', 'celery', 'garlic', 'water', 'kosher salt', 'bay leaf', 'barley', 'black pepper']",11,,duckduckgo.com/iu/?u=https%3A%2F%2Ftse3.mm.bing.net%2Fth%3Fid%3DOIP.FiSvadnweXgDF8-8S6m9-wHaKn%26pid%3DApi&f=1&ipt=74d8eb31bf60aa6c75d359653dde0b7e1691b1880f89606c647c20f3ac16357a&ipo=images
163,Chocolate-Thumbprints-Martha-Stewart,chocolate thumbprints,4.0,3000.0,"[Lunch and Snacks, Desserts]",[American],"[unsalted butter, confectioners sugar, salt, pure vanilla extract, all-purpose flour, semisweet chocolate, light corn syrup]","['butter', 'confectioner sugar', 'salt', 'pure vanilla extract', 'all purpose flmy', 'semisweet chocolate', 'light corn syrup']",7,50.0,duckduckgo.com/iu/?u=https%3A%2F%2Ftse4.mm.bing.net%2Fth%3Fid%3DOIP.XZdEojW4xrhtydgWa3xJwwHaLH%26pid%3DApi&f=1&ipt=61485c4934b472c05b74e05514936b574276c5b79a421f5575cebca2bb5ca89f&ipo=images
164,Lobster-Roll-471886,lobster roll,5.0,900.0,[Lunch and Snacks],[American],"[lobster, mayonnaise low fat, sea salt, pepper, grated lemon zest, lemon juice, hot dog rolls]","['lobster', 'mayonnaise low fat', 'sea salt', 'pepper', 'lemon zest', 'lemon juice', 'hot dog roll']",7,15.0,duckduckgo.com/iu/?u=https%3A%2F%2Ftse1.mm.bing.net%2Fth%3Fid%3DOIP.YNVCoDubxwZz-k2nM9surwHaKL%26pid%3DApi&f=1&ipt=e21fd163b56cae25debc77c37a033c1860d2dda626720e980eb7bde0e8ab2385&ipo=images
165,Mustard_Glazed-Salmon-Martha-Stewart_1,mustard-glazed salmon,3.0,900.0,[Main Dishes],[American],"[olive oil, dijon mustard, fresh lemon juice, pepper, salt, salmon fillets, fresh dill]","['olive oil', 'dijon mustard', 'lemon juice', 'pepper', 'salt', 'salmon fillet', 'dill']",7,15.0,duckduckgo.com/iu/?u=https%3A%2F%2Ftse4.mm.bing.net%2Fth%3Fid%3DOIP.dYKC4OSoNlehbynZ6saHSAHaFj%26pid%3DApi&f=1&ipt=8882b0752a157ce79a2b8daabd5dcad378e5c2a5716a9015c7c97a896bfbda8d&ipo=images
166,Mushroom-Gravy-Martha-Stewart-190560,mushroom gravy,4.0,3600.0,[Condiments and Sauces],[American],"[mushrooms, unsalted butter, shallots, marsala wine, all-purpose flour, fresh thyme leaves]","['mushroom', 'butter', 'shallot', 'marsala wine', 'all purpose flmy', 'thyme leaf']",6,60.0,duckduckgo.com/iu/?u=https%3A%2F%2Ftse4.mm.bing.net%2Fth%3Fid%3DOIP.HkZpfc6RBfs9xvOelg6vBgHaLH%26pid%3DApi&f=1&ipt=e9cf8fd94c39b1cc3be4bd9fae2183a4185f6e82400e336b491c131e53b4706b&ipo=images
167,Sour-Cream-Cheesecake-461491,sour cream cheesecake,4.0,43200.0,[Desserts],[American],"[graham cracker crumbs, butter, sugar, eggs, cream cheese, salt, vanilla, daisy sour cream]","['graham cracker crumb', 'butter', 'sugar', 'egg', 'cream cheese', 'salt', 'vanilla', 'daisy smy cream']",8,720.0,duckduckgo.com/iu/?u=https%3A%2F%2Ftse4.mm.bing.net%2Fth%3Fid%3DOIP.3Hrqapeh2AQUg4y4cxSaVgHaHa%26pid%3DApi&f=1&ipt=63dcadb784de4966ee7cfd1207148f618f024c12b36c9ddb54677fa7f6492a32&ipo=images
168,Sliced-tomato_-olive-and-goat-cheese-salad-with-onion-caper-vinaigrette-309989,"sliced tomato, olive, and goat cheese salad with onion-caper vinaigrette",5.0,,[Salads],[American],"[vine ripened tomatoes, kalamata, cheese, balsamic vinegar, extra-virgin olive oil, capers, purple onion]","['tomato', 'kalamatum', 'cheese', 'balsamic vinegar', 'extra virgin olive oil', 'caper', 'purple onion']",7,,duckduckgo.com/iu/?u=https%3A%2F%2Ftse3.mm.bing.net%2Fth%3Fid%3DOIP.RNYA4ypwYe1F5WC0lL88ygHaLU%26pid%3DApi&f=1&ipt=d2c051407b8334ffaf0f899ea2f82d85e2dd1cfbe5ac14c3abb955a158759a84&ipo=images
169,Popovers-Allrecipes,popovers,5.0,3000.0,"[Breakfast and Brunch, Breads]",[American],"[eggs, all-purpose flour, milk, salt]","['egg', 'all purpose flmy', 'milk', 'salt']",4,50.0,duckduckgo.com/iu/?u=https%3A%2F%2Ftse1.mm.bing.net%2Fth%3Fid%3DOIP.eDDTsA6tPwJlo7dA-u-vBwHaLH%26pid%3DApi&f=1&ipt=7d42020a064106aa3d760c77b25693d507de1ae32e55e171f09f41fe65622e68&ipo=images
170,Honey-Balsamic-Vinaigrette-Martha-Stewart-196569,honey-balsamic vinaigrette,4.0,600.0,[Salads],[American],"[balsamic vinegar, honey, dijon mustard, extra-virgin olive oil, coarse salt, ground pepper]","['balsamic vinegar', 'honey', 'dijon mustard', 'extra virgin olive oil', 'coarse salt', 'pepper']",6,10.0,duckduckgo.com/iu/?u=https%3A%2F%2Ftse3.mm.bing.net%2Fth%3Fid%3DOIP.Rb58vH1CJmiEAwkGtP1MDwHaLH%26pid%3DApi&f=1&ipt=d35e8fe2cf400089a7e071f3b998a5f38bc53998404c0c8410fa29a15ab9badf&ipo=images
171,Jerk-Seasoning-Martha-Stewart,jerk seasoning,4.0,1500.0,,[American],"[dried thyme, sugar, allspice, coarse salt, cayenne pepper, ground pepper]","['thyme', 'sugar', 'allspice', 'coarse salt', 'cayenne pepper', 'pepper']",6,25.0,duckduckgo.com/iu/?u=https%3A%2F%2Ftse1.mm.bing.net%2Fth%3Fid%3DOIP.hZAuWkW7j6At75bpJhtvBgHaHa%26pid%3DApi&f=1&ipt=ffdf2c058ef60f4793dafbbb0579ad25216dbfb39d75ad16c80aac134b9792cd&ipo=images
172,Blueberry-crisp-304344,blueberry crisp,4.0,2280.0,[Desserts],[American],"[fresh blueberries, all-purpose flour, firmly packed light brown sugar, quick-cooking oats, ground cinnamon, hellmann' or best food real mayonnais]","['blueberry', 'all purpose flmy', 'light brown sugar', 'quick cooking oat', 'cinnamon', 'hellmann best food real mayonnai']",6,38.0,duckduckgo.com/iu/?u=https%3A%2F%2Ftse2.mm.bing.net%2Fth%3Fid%3DOIP.RsY2ez6pb1rvCaRjZ7NqcwHaLH%26pid%3DApi&f=1&ipt=5d3dbe2276a92051b4150551c43f9c98accc58467747b06887b99c63eb04522e&ipo=images
173,Simple-Syrup-Martha-Stewart,simple syrup,4.0,1800.0,"[Condiments and Sauces, Beverages]","[American, Cuban]","[sugar, water]","['sugar', 'water']",2,30.0,duckduckgo.com/iu/?u=https%3A%2F%2Ftse3.mm.bing.net%2Fth%3Fid%3DOIP.ivUOri7ka-44UW8yx1WU3AHaHa%26pid%3DApi&f=1&ipt=49bc998255af9b26e62e514058da8276c3ca2fd3601a2c25300298532de110f0&ipo=images
174,Peach-Crumble-I-Adore-Food-55298,peach crumble,5.0,,[Desserts],[American],"[peaches, all-purpose flour, rolled oats, brown sugar, melted butter]","['peach', 'all purpose flmy', 'oat', 'brown sugar', 'butter']",5,,duckduckgo.com/iu/?u=https%3A%2F%2Ftse2.mm.bing.net%2Fth%3Fid%3DOIP.Oa1v7H_HBMY3a9MzcAuKWwHaHa%26pid%3DApi&f=1&ipt=ad91958896b1aa503e58ad7e40e280604416b5a72f3d49d0614c365d32057481&ipo=images
175,Roasted-Onions-Allrecipes,roasted onions,4.0,2400.0,[Side Dishes],[American],"[yellow onion, olive oil, salt, ground pepper, balsamic vinegar]","['yellow onion', 'olive oil', 'salt', 'pepper', 'balsamic vinegar']",5,40.0,duckduckgo.com/iu/?u=https%3A%2F%2Ftse3.mm.bing.net%2Fth%3Fid%3DOIP.t-atXWzsp7uE-dl89jSIJgHaKX%26pid%3DApi&f=1&ipt=14bedf2b7acb965929cf83a532bacc2afb24a64629e8e3a22e3bb731cd49cafd&ipo=images
176,Lemon-Glaze-Martha-Stewart,lemon glaze,4.0,1200.0,[Condiments and Sauces],[American],"[confectioners sugar, grated lemon zest, fresh lemon juice]","['confectioner sugar', 'lemon zest', 'lemon juice']",3,20.0,duckduckgo.com/iu/?u=https%3A%2F%2Ftse3.mm.bing.net%2Fth%3Fid%3DOIP.iMHmRSpAYM9adcs30F4g2AHaLG%26pid%3DApi&f=1&ipt=87cf44d975a16115ca1a3aebcd2f6e182b40885964ddef5b6c1915f4649ee03d&ipo=images
177,Spicy-Roasted-Chickpeas-Martha-Stewart-193185,spicy roasted chickpeas,4.0,1500.0,"[Appetizers, Lunch and Snacks]",[American],"[extra-virgin olive oil, chickpeas, cayenne pepper, cumin seed, coarse salt]","['extra virgin olive oil', 'chickpea', 'cayenne pepper', '', 'coarse salt']",5,25.0,duckduckgo.com/iu/?u=https%3A%2F%2Ftse4.mm.bing.net%2Fth%3Fid%3DOIP.yOLCEuLyZF7KmFGgL2F0-AHaHM%26pid%3DApi&f=1&ipt=0bf7d2b9a50f628a682561381d32e6437d630059dd081847dcf6f73eee5ed5c0&ipo=images
178,Apricot-butter-345632,apricot butter,5.0,2700.0,"[Appetizers, Condiments and Sauces]",[American],"[dried apricot, water, butter, vanilla extract, sea salt]","['apricot', 'water', 'butter', 'vanilla extract', 'sea salt']",5,45.0,duckduckgo.com/iu/?u=https%3A%2F%2Ftse3.mm.bing.net%2Fth%3Fid%3DOIP.GMlmsUOM5NcTVP2C5tig8AHaIt%26pid%3DApi&f=1&ipt=fc19b149bb71394a3daa5ad18215f46f7f0b03a81425a0eec47f890ce1dc03e0&ipo=images
179,Caramelized-Onions-Martha-Stewart_1,caramelized onions,4.0,4500.0,"[Appetizers, Side Dishes]",[American],"[unsalted butter, yellow onion, coarse salt, sugar]","['butter', 'yellow onion', 'coarse salt', 'sugar']",4,75.0,duckduckgo.com/iu/?u=https%3A%2F%2Ftse2.mm.bing.net%2Fth%3Fid%3DOIP.YNhVpUpeeW2K_vZGsAqTMgHaLG%26pid%3DApi&f=1&ipt=0f99c157a5d7b6da54319f6bd8ccb5ab04a29749232d5086e414a0f5a50a812b&ipo=images
180,Buttermilk-Chess-Pie-Allrecipes,buttermilk chess pie,5.0,4800.0,[Desserts],"[Southern & Soul Food, American]","[white sugar, all-purpose flour, eggs, buttermilk, melted butter, vanilla extract, unbaked pie crusts]","['white sugar', 'all purpose flmy', 'egg', 'buttermilk', 'butter', 'vanilla extract', 'pie crust']",7,80.0,duckduckgo.com/iu/?u=https%3A%2F%2Ftse3.mm.bing.net%2Fth%3Fid%3DOIP.sv913FY53BAXhAlrCpMs5QHaJQ%26pid%3DApi&f=1&ipt=03d0d90c448c5dd2ed15d58f1fe552a4255f7885ee953f32c0f0c3de60ab40f8&ipo=images
181,Sauteed-brussels-sprouts-with-pancetta-352453,sautéed brussels sprouts with pancetta,5.0,,[Side Dishes],[American],"[pancetta, brussels sprouts, extra-virgin olive oil, garlic, ground pepper, kosher salt]","['pancettum', 'brussel sprout', 'extra virgin olive oil', 'garlic', 'pepper', 'kosher salt']",6,,duckduckgo.com/iu/?u=https%3A%2F%2Ftse4.mm.bing.net%2Fth%3Fid%3DOIP.p8NY9XYz0i5sZEpxXsiW4wHaLG%26pid%3DApi&f=1&ipt=17a8a83d35164fbd4034eff8de62f64afee048784a3aba6800ff5bdf6d94e0bb&ipo=images
182,Chocolate-Banana-Pops-Martha-Stewart-241064,chocolate banana pops,5.0,600.0,[Desserts],"[American, Kid-Friendly]","[bananas, semi-sweet chocolate morsels, sprinkles]","['banana', 'semi sweet chocolate morsel', 'sprinkle']",3,10.0,duckduckgo.com/iu/?u=https%3A%2F%2Ftse1.mm.bing.net%2Fth%3Fid%3DOIP._9m9snWDBXRe3EUx830LQgHaLH%26pid%3DApi&f=1&ipt=d7d83331515a5f4d439ca68766680565deae55223b7be7d64930e944a6a8382b&ipo=images
183,Soul-Smothered-Chicken-Allrecipes,soul smothered chicken,5.0,4500.0,[Main Dishes],[American],"[butter, chicken, salt, ground black pepper, all-purpose flour, yellow onion, chopped celery, garlic, carrots, chicken broth, cayenne pepper]","['butter', 'chicken', 'salt', 'black pepper', 'all purpose flmy', 'yellow onion', 'celery', 'garlic', 'carrot', 'chicken broth', 'cayenne pepper']",11,75.0,duckduckgo.com/iu/?u=https%3A%2F%2Ftse3.mm.bing.net%2Fth%3Fid%3DOIP.NZv50lLREwWXc8QpTr9E-wHaDm%26pid%3DApi&f=1&ipt=06ffd9da77878dffc3d2c1028223e1e564424ec525087168c71d51c3a4de009e&ipo=images
184,Horseradish-Sauce-Allrecipes_1,horseradish sauce,4.0,300.0,[Condiments and Sauces],[American],"[sour cream, prepared horseradish, dill weed, salt]","['smy cream', 'horseradish', '', 'salt']",4,5.0,duckduckgo.com/iu/?u=https%3A%2F%2Ftse3.mm.bing.net%2Fth%3Fid%3DOIP.8FPjFGfOlCZeVmY33fnLFwHaLH%26pid%3DApi&f=1&ipt=748eacdb4938a2822878b9261b724b35a7af253f70dcacec9e21eac23c27b062&ipo=images
185,Churros-Martha-Stewart-190501,churros,4.0,2400.0,"[Lunch and Snacks, Appetizers, Desserts]","[Spanish, Southwestern, American]","[unsalted butter, granulated sugar, coarse salt, all-purpose flour, large eggs, vegetable oil, confectioners sugar, dipping sauces]","['butter', 'sugar', 'coarse salt', 'all purpose flmy', 'egg', 'vegetable oil', 'confectioner sugar', 'dipping sauce']",8,40.0,duckduckgo.com/iu/?u=https%3A%2F%2Ftse3.mm.bing.net%2Fth%3Fid%3DOIP.IidV0PchIWUuqRTXeqKzrwHaLI%26pid%3DApi&f=1&ipt=63db43c42d94d674f06f41881c6f6c733031edbc626379f1bd76a1bef9d10a9f&ipo=images
186,Cream-of-Broccoli-I-Adore-Food_-200803,cream of broccoli,4.0,,[Soups],[American],"[butter, onions, celery ribs, chicken broth, broccoli florets, all-purpose flour, milk, pepper, salt]","['butter', 'onion', 'celery rib', 'chicken broth', 'broccoli floret', 'all purpose flmy', 'milk', 'pepper', 'salt']",9,,duckduckgo.com/iu/?u=https%3A%2F%2Ftse2.mm.bing.net%2Fth%3Fid%3DOIP.ixV9sqaAAGEEr_ZLcnBLvAHaE8%26pid%3DApi&f=1&ipt=929bf5afac2fc06fc7b9c533a5b795227d6a79a26232a219016b4a204eb2d5de&ipo=images
187,Cinnamon-Cookies-531535,cinnamon cookies,4.0,3000.0,[Desserts],[American],"[eggs, butter, cake flour, sugar, ground cinnamon]","['egg', 'butter', 'cake flmy', 'sugar', 'cinnamon']",5,50.0,duckduckgo.com/iu/?u=https%3A%2F%2Ftse2.mm.bing.net%2Fth%3Fid%3DOIP.gk_tDEiQYw2XBsjy4-2PeAHaLG%26pid%3DApi&f=1&ipt=e58e40d1bf6f60c816d053df5aa1770d4dfef6996dcc752507d0a2080834d8cc&ipo=images
188,Popovers-Martha-Stewart,popovers,4.0,3600.0,"[Breakfast and Brunch, Breads]",[American],"[whole milk, all-purpose flour, coarse salt, large eggs, unsalted butter]","['milk', 'all purpose flmy', 'coarse salt', 'egg', 'butter']",5,60.0,duckduckgo.com/iu/?u=https%3A%2F%2Ftse1.mm.bing.net%2Fth%3Fid%3DOIP.eDDTsA6tPwJlo7dA-u-vBwHaLH%26pid%3DApi&f=1&ipt=7d42020a064106aa3d760c77b25693d507de1ae32e55e171f09f41fe65622e68&ipo=images
189,Roasted-Fennel-Martha-Stewart,roasted fennel,4.0,2100.0,[Side Dishes],[American],"[fennel bulb, olive oil, coarse salt, ground pepper]","['fennel bulb', 'olive oil', 'coarse salt', 'pepper']",4,35.0,duckduckgo.com/iu/?u=https%3A%2F%2Ftse4.mm.bing.net%2Fth%3Fid%3DOIP.-JY5TqzzOicj3FCpQP6UawHaGF%26pid%3DApi&f=1&ipt=2dbbdfe06f3d04dde81892be9c9456520b934d9ab83056a46f7e7b629ea6750a&ipo=images
190,Baked-French-Toast-471780,baked french toast,5.0,3900.0,[Breakfast and Brunch],[American],"[large eggs, whipping cream, vanilla extract, ground cinnamon, french bread, salted butter]","['egg', 'whipping cream', 'vanilla extract', 'cinnamon', 'french bread', 'butter']",6,65.0,duckduckgo.com/iu/?u=https%3A%2F%2Ftse1.mm.bing.net%2Fth%3Fid%3DOIP.USVKUuXMwrHJfGcVMA5oogHaLH%26pid%3DApi&f=1&ipt=9f9967ff8b3b3615c73b344b3f00c641c3bdd143ea2519c7a8ea1a8c10f84c97&ipo=images
191,Roast-Chicken-MyRecipes-237621,roast chicken,4.0,5700.0,[Main Dishes],[American],"[whole chicken, kosher salt, lemon, pepper, dried rosemary, olive oil, butter]","['chicken', 'kosher salt', 'lemon', 'pepper', 'rosemary', 'olive oil', 'butter']",7,95.0,duckduckgo.com/iu/?u=https%3A%2F%2Ftse4.mm.bing.net%2Fth%3Fid%3DOIP.sXUJcjfIJSEE-jD9S_1IMAHaHa%26pid%3DApi&f=1&ipt=fcfcec5d0fafb23fede23daa3cfe670ea14e89655c206b064f4c40aaf063a612&ipo=images
192,Smoked-Turkey-511726,smoked turkey,5.0,16200.0,[Main Dishes],[American],"[brine, turkey, kosher salt, cracked black pepper]","['brine', 'turkey', 'kosher salt', 'black pepper']",4,270.0,duckduckgo.com/iu/?u=https%3A%2F%2Ftse2.mm.bing.net%2Fth%3Fid%3DOIP.SjA3WwBqBuo3RBpf6ZhngQHaE8%26pid%3DApi&f=1&ipt=07b5561be6cfb6c0d74980766512aa5359cd5b1aced1805e2a0c0f1ef36b1b96&ipo=images
193,Carne-Adovada-Allrecipes_1,carne adovada,4.0,73200.0,,"[Southwestern, American]","[new mexico red chile powder, corn starch, fresh lemon juice, water, beef roast]","['chile powder', 'corn starch', 'lemon juice', 'water', 'beef roast']",5,1220.0,duckduckgo.com/iu/?u=https%3A%2F%2Ftse3.mm.bing.net%2Fth%3Fid%3DOIP.66lPF0ki_M4DjO_y3uAHywHaE8%26pid%3DApi&f=1&ipt=ca7c3c7fb6950d4b40e3a395f14818737d9eb876afe57dfadf3c9a68e642ff5b&ipo=images
194,Peppermint-brownies-369318,peppermint brownies,5.0,3900.0,[Desserts],"[American, Kid-Friendly]","[scharffen berger chocolate, butter, white sugar, eggs, vanilla extract, peppermint extract, kosher salt, all-purpose flour, chocolate bars, peppermint]","['scharffen berger chocolate', 'butter', 'white sugar', 'egg', 'vanilla extract', 'peppermint extract', 'kosher salt', 'all purpose flmy', 'chocolate bar', 'peppermint']",10,65.0,duckduckgo.com/iu/?u=https%3A%2F%2Ftse2.mm.bing.net%2Fth%3Fid%3DOIP.AH-DmIaPxvJqQ5vafcu8DQHaLH%26pid%3DApi&f=1&ipt=1b422be3ebce813e51d037d19ddcbf68217597deef94184107e12c7495056930&ipo=images
195,Boston-Iced-Tea-Allrecipes,boston iced tea,5.0,2100.0,[Beverages],"[American, Kid-Friendly]","[water, white sugar, tea bags, frozen cranberry juice concentrate]","['water', 'white sugar', 'tea bag', 'cranberry juice concentrate']",4,35.0,duckduckgo.com/iu/?u=https%3A%2F%2Ftse2.mm.bing.net%2Fth%3Fid%3DOIP.EtWHQGmsXmVdV3bcMdEl1QAAAA%26pid%3DApi&f=1&ipt=a177df8634577cfba78b80d64b051188411a6685489ca88b62277ebf75f3fcfe&ipo=images
196,Mashed-Potato-Casserole-461504,mashed potato casserole,3.0,3900.0,[Side Dishes],[American],"[potatoes, salt, butter, daisy sour cream, sharp cheddar cheese, fresh chives, french fried onions, bacon pieces]","['potato', 'salt', 'butter', 'daisy smy cream', 'dar cheese', 'chive', 'onion', 'bacon piece']",8,65.0,duckduckgo.com/iu/?u=https%3A%2F%2Ftse1.mm.bing.net%2Fth%3Fid%3DOIP.-58BT0_HVw1VSrGeake9EQHaJQ%26pid%3DApi&f=1&ipt=9e4066563492632d51e8997e5599f9a1f8d670edc2c53ff081cbc472a734ea1b&ipo=images
197,Cranberry-Port-Sauce-1374386,cranberry port sauce,3.0,1800.0,[Condiments and Sauces],[American],"[fruit, frozen cranberries, grated orange peel, orange juice, sugar, port]","['fruit', 'cranberry', 'orange peel', 'orange juice', 'sugar', 'port']",6,30.0,duckduckgo.com/iu/?u=https%3A%2F%2Ftse2.mm.bing.net%2Fth%3Fid%3DOIP.QYMC7Npn0qbqbQCm_vFzMQHaHa%26pid%3DApi&f=1&ipt=926adda251b4cb04f086f8499ccfd05ab225e586b66223268b0a34e586dca905&ipo=images
198,Cream_Cheese-Pound-Cakes-Martha-Stewart,cream-cheese pound cakes,4.0,6300.0,[Desserts],[American],"[unsalted butter, cream cheese, sugar, large eggs, vanilla extract, all-purpose flour, salt, nonstick spray]","['butter', 'cream cheese', 'sugar', 'egg', 'vanilla extract', 'all purpose flmy', 'salt', 'nonstick spray']",8,105.0,duckduckgo.com/iu/?u=https%3A%2F%2Ftse4.mm.bing.net%2Fth%3Fid%3DOIP.BNbpF1erm7Wnsei6-BIblgHaKj%26pid%3DApi&f=1&ipt=ccb0f0a8af29c9e90c8a38a4d6bfcc0828aaec311b264155d8cf03adaef51ec4&ipo=images
199,Maple-Pecan-Oatmeal-469994,maple pecan oatmeal,4.0,1800.0,[Breakfast and Brunch],[American],"[old-fashioned oats, milk, vanilla, ground flaxseed, brown sugar, maple syrup, cinnamon, chopped pecans]","['oat', 'milk', 'vanilla', '', 'brown sugar', 'maple syrup', 'cinnamon', 'pecan']",8,30.0,duckduckgo.com/iu/?u=https%3A%2F%2Ftse2.mm.bing.net%2Fth%3Fid%3DOIP.Sfy5NxKHvTbtjV5bbnE38QHaLH%26pid%3DApi&f=1&ipt=eb025f355859c76981132bf1d7ab1ec6e5c6f80e9743a5bd525fb46992ac3281&ipo=images
200,Honey-and-Balsamic-Onions-Chicken-Skillet-475715,honey and balsamic-onions chicken skillet,4.0,1800.0,[Main Dishes],"[American, Kid-Friendly]","[extra-virgin olive oil, sweet onion, balsamic vinegar, chicken breasts, garlic salt, pepper, chicken broth, honey]","['extra virgin olive oil', 'sweet onion', 'balsamic vinegar', 'chicken breast', 'garlic salt', 'pepper', 'chicken broth', 'honey']",8,30.0,duckduckgo.com/iu/?u=https%3A%2F%2Ftse2.mm.bing.net%2Fth%3Fid%3DOIP.QyamUjUepJXKMXEwA_843wHaLC%26pid%3DApi&f=1&ipt=c13e8ebbf6a5b513492a4333c300fa3502440b1c311b52c5b80654a491935462&ipo=images
201,Dynamite-Sauce-Allrecipes,dynamite sauce,5.0,300.0,[Condiments and Sauces],[American],"[mayonnaise, sugar, garlic chili sauce]","['mayonnaise', 'sugar', 'garlic chili sauce']",3,5.0,duckduckgo.com/iu/?u=https%3A%2F%2Ftse1.mm.bing.net%2Fth%3Fid%3DOIP.e0A3OaAeSBCml26dRTxlzwHaEK%26pid%3DApi&f=1&ipt=72f7f5aa8aedc3332b26004e429e84195f390110decec56884523c6a10ba317b&ipo=images
202,Oven-roasted-root-vegetables-298346,oven-roasted root vegetables,4.0,3000.0,[Side Dishes],[American],"[best foods mayonnaise dressing with extra virgin olive oil, assorted fresh vegetables, garlic, fresh rosemary, ground black pepper]","['best food mayonnaise dressing extra virgin olive oil', 'vegetable', 'garlic', 'rosemary', 'black pepper']",5,50.0,duckduckgo.com/iu/?u=https%3A%2F%2Ftse3.mm.bing.net%2Fth%3Fid%3DOIP.haXH-i68hqlYh9UrNsmw7gHaKX%26pid%3DApi&f=1&ipt=32fdcd78ac84b2a17c1a2dcc1d8ca05696d95f3f3eb17ad5b5fa924d90b01b58&ipo=images
203,Cantaloupe-salsa-305507,cantaloupe salsa,5.0,1200.0,"[Appetizers, Condiments and Sauces]",[American],"[cantaloupe, sweet onion, fresh basil, green chile, fresh lime juice, salt]","['cantaloupe', 'sweet onion', 'basil', 'chile', 'lime juice', 'salt']",6,20.0,duckduckgo.com/iu/?u=https%3A%2F%2Ftse3.mm.bing.net%2Fth%3Fid%3DOIP.j0R1Fcd0Af4KKvhD-gp0JgHaJQ%26pid%3DApi&f=1&ipt=e4b1f34f48aa1ad1862c00f37fe7313e75d3ac33665fcec02e177c5f8923df54&ipo=images
204,The-Best-Corn-Bread-You_ll-Ever-Eat-Allrecipes,the best corn bread you'll ever eat,4.0,2100.0,[Breads],[American],"[eggs, milk, vegetable oil, cornmeal, cream style corn, sour cream]","['egg', 'milk', 'vegetable oil', 'cornmeal', 'cream style corn', 'smy cream']",6,35.0,duckduckgo.com/iu/?u=https%3A%2F%2Ftse3.mm.bing.net%2Fth%3Fid%3DOIP.axVGkM7bQPYdiBoXDWfoHQHaHa%26pid%3DApi&f=1&ipt=ec3bd9c2292df90b68ab782aeb88dd4044de51aecaffe1a4e027c02d02fa429f&ipo=images
205,Scallion-mashed-potatoes-334882,scallion mashed potatoes,5.0,1800.0,[Side Dishes],[American],"[yukon gold potatoes, green onions, almond milk, extra-virgin olive oil, salt, black pepper]","['yukon gold potato', 'onion', 'almond milk', 'extra virgin olive oil', 'salt', 'black pepper']",6,30.0,duckduckgo.com/iu/?u=https%3A%2F%2Ftse4.mm.bing.net%2Fth%3Fid%3DOIP.2jQ6wR86NnYIa3vKaT-9SAHaKe%26pid%3DApi&f=1&ipt=80c37940699957b5efc8b48dfde91a80d3cef3ba70c38e201d33c622ade402f6&ipo=images
206,Collards-With-Red-Onions-1375809,collards with red onions,3.0,6000.0,[],[Southern & Soul Food],"[collard greens, purple onion, vegetable oil, vegetable broth, cider vinegar, dark brown sugar, salt, crushed red pepper]","['collard', 'purple onion', 'vegetable oil', 'vegetable broth', 'cider vinegar', 'dark brown sugar', 'salt', 'pepper']",8,100.0,duckduckgo.com/iu/?u=https%3A%2F%2Ftse3.mm.bing.net%2Fth%3Fid%3DOIP.nAcI7NadL0dvmzJ4QXFBqAHaEK%26pid%3DApi&f=1&ipt=98ef67351f50e5aafd4afe52d9b93b65daec3709c6f21581a55b7dcf27554df4&ipo=images
207,Easy-jambalaya-296488,easy jambalaya,4.0,1200.0,[Main Dishes],"[American, Cajun & Creole, Southern & Soul Food]","[sweet italian sausag links, cut into, green bell pepper, knorr cajun side   red bean & rice, water, celery, onion powder]","['sweet italian sausag link', 'cut', 'bell pepper', 'bean rice', 'water', 'celery', 'onion powder']",7,20.0,duckduckgo.com/iu/?u=https%3A%2F%2Ftse4.mm.bing.net%2Fth%3Fid%3DOIP.Eg9iL5YMjK6ajapZL9zVYwHaHa%26pid%3DApi&f=1&ipt=2f4daebc2cee227ab0f7b8136c823a7822262865764aee03f08848e2ed594577&ipo=images
