,id,recipeName,rating,totalTimeInSeconds,course,cuisine,ingredients,clean_ingredients,ingredient_count,timeMins,imageURL
208,California-Roll-480549,california roll,4.0,4500.0,"[Appetizers, Main Dishes]","[American, Asian]","[sushi rice, avocado, crabmeat, seeds, nori, toasted sesame seeds, wasabi, soy sauce]","['sushi rice', 'avocado', 'crabmeat', '', 'norus', '', 'wasabi', 'soy sauce']",8,75.0,duckduckgo.com/iu/?u=https%3A%2F%2Ftse3.mm.bing.net%2Fth%3Fid%3DOIP.MVWy3EMWga0kOaIzZvTVpAHaE8%26pid%3DApi&f=1&ipt=be34185d702c7daee374246c2d9e8893ea5e0ec9d3870d082bfea8a8c39c3ecb&ipo=images
209,Kale-Chips-Martha-Stewart-239499,kale chips,5.0,1500.0,[Lunch and Snacks],[American],"[kale, extra-virgin olive oil, coarse salt]","['kale', 'extra virgin olive oil', 'coarse salt']",3,25.0,duckduckgo.com/iu/?u=https%3A%2F%2Ftse4.mm.bing.net%2Fth%3Fid%3DOIP.utsEZ1ZXFPX_t0C4LB7R8AHaFj%26pid%3DApi&f=1&ipt=2a37106614b408fce9a474546bf25b9d1eb691956791f9f854175507fbe3b15d&ipo=images
210,Croutons-Martha-Stewart-196379,croutons,3.0,1500.0,"[Lunch and Snacks, Breads]",[American],"[butter, sourdough bread, freshly ground pepper, coarse salt]","['butter', 'sourdough bread', 'pepper', 'coarse salt']",4,25.0,duckduckgo.com/iu/?u=https%3A%2F%2Ftse4.mm.bing.net%2Fth%3Fid%3DOIP.XpYRvSu2R-C3eX9MGYamkQHaLG%26pid%3DApi&f=1&ipt=8b98df2f8a7b3189b7159d1137404ef8d7ced8dd6d30087b9f8327d4e0d28c18&ipo=images
211,Chocolate-Pudding-Cake-Martha-Stewart,chocolate pudding cake,4.0,3300.0,[Desserts],[American],"[butter, granulated sugar, large eggs, semisweet chocolate, salt, confectioners sugar]","['butter', 'sugar', 'egg', 'semisweet chocolate', 'salt', 'confectioner sugar']",6,55.0,duckduckgo.com/iu/?u=https%3A%2F%2Ftse2.mm.bing.net%2Fth%3Fid%3DOIP.z3SJ2nCCYSaw18hf0D-hjAHaHa%26pid%3DApi&f=1&ipt=547ec8f7a3f6f22353357a440ad5e51e486a7c39d46ac9a0c4f5ed014dbd8fa4&ipo=images
212,Easy-Gravy-Allrecipes,easy gravy,4.0,1500.0,[Condiments and Sauces],[American],"[margarine, all-purpose flour, vegetable broth, miso paste, warm water, soy sauce, onion powder]","['margarine', 'all purpose flmy', 'vegetable broth', 'miso paste', 'warm water', 'soy sauce', 'onion powder']",7,25.0,duckduckgo.com/iu/?u=https%3A%2F%2Ftse4.mm.bing.net%2Fth%3Fid%3DOIP.icwdQKOwkY5dvA8jD1fppgHaKX%26pid%3DApi&f=1&ipt=ab5c643e3e5fb8c03d67bad9f5b047679b62bc09666b9845e9a85ae5200a21e3&ipo=images
213,Chocolate-Thumbprints-482304,chocolate thumbprints,4.0,1800.0,"[Desserts, Lunch and Snacks]",[American],"[unsalted butter, confectioners sugar, salt, vanilla extract, all-purpose flour, semisweet chocolate, corn syrup]","['butter', 'confectioner sugar', 'salt', 'vanilla extract', 'all purpose flmy', 'semisweet chocolate', 'corn syrup']",7,30.0,duckduckgo.com/iu/?u=https%3A%2F%2Ftse4.mm.bing.net%2Fth%3Fid%3DOIP.XZdEojW4xrhtydgWa3xJwwHaLH%26pid%3DApi&f=1&ipt=61485c4934b472c05b74e05514936b574276c5b79a421f5575cebca2bb5ca89f&ipo=images
214,Honey-Limeade-Allrecipes,honey limeade,5.0,900.0,[Beverages],[American],"[lime juice, water, white sugar, honey]","['lime juice', 'water', 'white sugar', 'honey']",4,15.0,duckduckgo.com/iu/?u=https%3A%2F%2Ftse4.mm.bing.net%2Fth%3Fid%3DOIP.YZw8Hcks-14efaxH1UPB6AHaL2%26pid%3DApi&f=1&ipt=844ee8af2abbf7c6a06e843157ef2a897dc4b049f4d6a2c207984739e4567060&ipo=images
215,Amazing-Ribs-Allrecipes,amazing ribs,5.0,18600.0,[Main Dishes],"[Southwestern, American]","[pork baby back ribs, black pepper, salt, crushed red pepper, barbecue sauce, beer]","['pork baby rib', 'black pepper', 'salt', 'pepper', 'barbecue sauce', 'beer']",6,310.0,duckduckgo.com/iu/?u=https%3A%2F%2Ftse1.mm.bing.net%2Fth%3Fid%3DOIP.hiNPSpMaWpAr-iZ16mMRNAHaHa%26pid%3DApi&f=1&ipt=58a570e98eab91cf29d691e330e70df8de01737c53fd21eecec724ab6b3e3ba2&ipo=images
216,Homemade-Chocolate-Almond-Butter-532146,homemade chocolate almond butter,4.0,600.0,[Desserts],[American],"[almonds, semi-sweet chocolate morsels, sugar, sea salt]","['almond', 'semi sweet chocolate morsel', 'sugar', 'sea salt']",4,10.0,duckduckgo.com/iu/?u=https%3A%2F%2Ftse2.mm.bing.net%2Fth%3Fid%3DOIP.c4BomOTZsM9DNuVK6qxz1AHaLH%26pid%3DApi&f=1&ipt=f0f47766f437ce43cccd2d2d877ac287e7fdd9c8d139093f6695fa6906dedf52&ipo=images
217,Baked-potato-soup-299585,baked potato soup,3.0,1500.0,"[Lunch and Snacks, Soups]","[American, Irish]","[country crock® spread, baking potatoes, onions, milk, chicken broth, shredded cheddar cheese]","['country crock spread', 'baking potato', 'onion', 'milk', 'chicken broth', 'dar cheese']",6,25.0,duckduckgo.com/iu/?u=https%3A%2F%2Ftse3.mm.bing.net%2Fth%3Fid%3DOIP.prec7aBnn03-nffpqnefUwHaNK%26pid%3DApi&f=1&ipt=692ea3a58109f81e4df7839af77952101df587d293d245cc2a4a7c648da99a57&ipo=images
218,Cook-the-Book_-Chili-Con-Queso-Serious-Eats-45801,chili con queso,5.0,2100.0,[Appetizers],"[Southwestern, American]","[unsalted butter, yellow onion, serrano chile, chiles, garlic, all-purpose flour, whole milk, chopped cilantro, diced tomatoes, cheddar cheese, grated jack cheese, sour cream, salt, tortilla chips]","['butter', 'yellow onion', 'serrano chile', 'chile', 'garlic', 'all purpose flmy', 'milk', 'cilantro', 'tomato', 'dar cheese', 'jack cheese', 'smy cream', 'salt', 'tortilla chip']",14,35.0,duckduckgo.com/iu/?u=https%3A%2F%2Ftse1.mm.bing.net%2Fth%3Fid%3DOIP.NGjMQ8SVc8mpiZKFjgPoqwHaHa%26pid%3DApi&f=1&ipt=855f814e3a64316ae111fe3cd676cc7c7fd54a6e884ce0abc75467c6db77dfd0&ipo=images
219,Chopped-Apple-Salad-513350,chopped apple salad,5.0,1800.0,"[Lunch and Snacks, Salads]",[American],"[granny smith apples, baby spinach, belgian endive, chopped walnuts, blue cheese, red wine vinegar, dijon mustard, honey, extra-virgin olive oil, pomegranate molasses]","['granny smith apple', 'baby spinach', 'belgian endive', 'walnut', 'blue cheese', 'wine vinegar', 'dijon mustard', 'honey', 'extra virgin olive oil', 'pomegranate molass']",10,30.0,duckduckgo.com/iu/?u=https%3A%2F%2Ftse2.mm.bing.net%2Fth%3Fid%3DOIP.sJiO6ohnE5RhPTQ_2d4UdQHaFD%26pid%3DApi&f=1&ipt=cb94a06a7c0234f90537ac272839a896720125082d73e34e9ed576531fe007cb&ipo=images
220,Sweet-Potato-and-Quinoa-Salad-Naturally-Ella-46314,sweet potato and quinoa salad,5.0,3900.0,"[Side Dishes, Salads]",[American],"[sweet potatoes, quinoa, water, fresh basil, olive oil, feta cheese, pepper, salt]","['sweet potato', 'quinoa', 'water', 'basil', 'olive oil', 'fetum cheese', 'pepper', 'salt']",8,65.0,duckduckgo.com/iu/?u=https%3A%2F%2Ftse1.mm.bing.net%2Fth%3Fid%3DOIP.REevVu8Khk7cNiY-TwAkrQHaLG%26pid%3DApi&f=1&ipt=80dc56493f2527a26fa5054a6df322d71af4468f0d37ff66a4fb554e66de5dab&ipo=images
221,Apple-Dumplings-The-Pioneer-Woman-41443,apple dumplings,5.0,,[Desserts],[American],"[granny smith apples, crescent rolls, butter, sugar, vanilla, cinnamon, mountain dew soda]","['granny smith apple', 'crescent roll', 'butter', 'sugar', 'vanilla', 'cinnamon', 'mountain dew soda']",7,,duckduckgo.com/iu/?u=https%3A%2F%2Ftse4.mm.bing.net%2Fth%3Fid%3DOIP.9tUIA4fq_PJ82dgedNhrsAHaLH%26pid%3DApi&f=1&ipt=1754297450a7a29ae31a754769e4861e1aa6fc079eb9e5f84ee882a877425af6&ipo=images
222,Asian-slaw-297877,asian slaw,4.0,300.0,"[Salads, Side Dishes]","[American, Asian]","[hellmann' or best food real mayonnais, lime juice, sugar, salt, ground ginger, slaw mix, chopped cilantro fresh]","['hellmann best food real mayonnai', 'lime juice', 'sugar', 'salt', 'ginger', 'slaw mix', 'cilantro']",7,5.0,duckduckgo.com/iu/?u=https%3A%2F%2Ftse4.mm.bing.net%2Fth%3Fid%3DOIP.wTCAFzDcx_TGPNBwaUtfBgHaLH%26pid%3DApi&f=1&ipt=d4f3c1c6edf583dc1f210c20f31a4d2ad8d9c41f25a3d2486e4554ffe85943c8&ipo=images
223,Bacon-cheeseburger-dip-297605,bacon cheeseburger dip,4.0,1260.0,[Appetizers],[American],"[ground beef, shredded cheddar cheese, hellmann' or best food real mayonnais, sour cream, tomatoes, bacon, crisp-cooked and crumbled, purple onion]","['beef', 'dar cheese', 'hellmann best food real mayonnai', 'smy cream', 'tomato', 'bacon', '', 'purple onion']",8,21.0,duckduckgo.com/iu/?u=https%3A%2F%2Ftse3.mm.bing.net%2Fth%3Fid%3DOIP._4JiNLN7eN6re8pEuQpK_wHaJh%26pid%3DApi&f=1&ipt=f33cb93452bd478e6b6161ecfaf87f09a46516df2b0cf56b1509a6758a8aa96b&ipo=images
224,Composed-cobb-salad-303204,composed cobb salad,4.0,900.0,[Salads],[American],"[torn romain lettuc leav, tomatoes, turkey, avocado, cook egg hard, blue cheese, bacon, crisp-cooked and crumbled, salad]","['torn romain lettuc leav', 'tomato', 'turkey', 'avocado', 'cook egg hard', 'blue cheese', 'bacon', '', 'salad']",9,15.0,duckduckgo.com/iu/?u=https%3A%2F%2Ftse4.mm.bing.net%2Fth%3Fid%3DOIP.IpQrqi60NAWqKMshfEmSnwHaLH%26pid%3DApi&f=1&ipt=52d6c0fe60649c3473f9f96cd400f5cca90425d3ed222d1b3a135e3d7ed03045&ipo=images
225,Southern-Mashed-Potatoes-638619,southern mashed potatoes,4.0,2100.0,[Side Dishes],[American],"[potatoes, milk, salt, pepper, mayonnaise, butter]","['potato', 'milk', 'salt', 'pepper', 'mayonnaise', 'butter']",6,35.0,duckduckgo.com/iu/?u=https%3A%2F%2Ftse4.mm.bing.net%2Fth%3Fid%3DOIP.EpcF4GFpOsXvlrhrIw0VJAHaLH%26pid%3DApi&f=1&ipt=9d382c5fa1196487d795b45879dd181867602839813be9d6226c41b2af4cd073&ipo=images
226,Rainbow-Layer-Cake-Serious-Eats-45795,rainbow layer cake,5.0,6300.0,"[Afternoon Tea, Desserts]",[American],"[vanilla, unsalted butter, confectioners sugar, heavy cream, vanilla extract]","['vanilla', 'butter', 'confectioner sugar', 'heavy cream', 'vanilla extract']",5,105.0,duckduckgo.com/iu/?u=https%3A%2F%2Ftse3.mm.bing.net%2Fth%3Fid%3DOIP.UOwUKX91ksZay6RCh_QzWgHaHa%26pid%3DApi&f=1&ipt=dad1711db22f2a2334f522bce82dfa291497a958dc6141cacf1c621360322a0b&ipo=images
227,Braised-Broccolini-Martha-Stewart-239954,braised broccolini,3.0,1800.0,[Side Dishes],[American],"[extra-virgin olive oil, large garlic cloves, broccolini, low sodium chicken broth, coarse salt, red pepper flakes]","['extra virgin olive oil', 'garlic clove', 'broccolini', 'low sodium chicken broth', 'coarse salt', 'pepper flake']",6,30.0,duckduckgo.com/iu/?u=https%3A%2F%2Ftse4.mm.bing.net%2Fth%3Fid%3DOIP.elvQMaKO2yRrE3ONm6OC7QHaHa%26pid%3DApi&f=1&ipt=940fd8d12f406e0df4e24afbf15ac6d96cc07a4b1175ae254d571dfee9f26b04&ipo=images
228,Banana-cake-345598,banana cake,5.0,4200.0,"[Desserts, Lunch and Snacks]",[American],"[flour, sea salt, baking soda, agave nectar, grapeseed oil, eggs, vanilla extract, bananas]","['flmy', 'sea salt', 'baking soda', 'agave nectar', 'oil', 'egg', 'vanilla extract', 'banana']",8,70.0,duckduckgo.com/iu/?u=https%3A%2F%2Ftse2.mm.bing.net%2Fth%3Fid%3DOIP.YSCSlH0kLe869robigu8vQHaLH%26pid%3DApi&f=1&ipt=221a48b5f25133df3baf3751a514925b9bb6c08bcc3df5880779a594a2795151&ipo=images
229,Garlic-Croutons-Martha-Stewart-195485,garlic croutons,4.0,1500.0,[Side Dishes],[American],"[day old bread, extra-virgin olive oil, garlic cloves, coarse salt]","['day old bread', 'extra virgin olive oil', 'garlic clove', 'coarse salt']",4,25.0,duckduckgo.com/iu/?u=https%3A%2F%2Ftse1.mm.bing.net%2Fth%3Fid%3DOIP.VQMKtiVcvfd63H67ZXkNLwHaNL%26pid%3DApi&f=1&ipt=82acd8bfdb2b43d3178f138779b24cc5ffaee6c156a41f6c28bf558b0ed2fd2e&ipo=images
230,Watercress-and-Cucumber-Salad-Martha-Stewart,watercress and cucumber salad,4.0,600.0,[Salads],[American],"[olive oil, white wine vinegar, dijon mustard, coarse salt, ground pepper, watercress, english cucumber]","['olive oil', 'white wine vinegar', 'dijon mustard', 'coarse salt', 'pepper', 'watercres', 'english cucumber']",7,10.0,duckduckgo.com/iu/?u=https%3A%2F%2Ftse1.mm.bing.net%2Fth%3Fid%3DOIP.2zMJdT_hXnuh9Tk35FdTDQHaHa%26pid%3DApi&f=1&ipt=9c3b43fd19c422565ad8335f54b5fbb1bb45d9eb1a602b8553c7ee5e1a044d27&ipo=images
231,French-in-a-Flash_-Broccoli-Gratin-Serious-Eats-41968,broccoli gratin,5.0,3300.0,"[Lunch and Snacks, Side Dishes]",[American],"[broccoli florets, crème fraîche, gruyere cheese, kosher salt, ground black pepper, panko]","['broccoli floret', 'crème fraîche', 'gruyere cheese', 'kosher salt', 'black pepper', 'panko']",6,55.0,duckduckgo.com/iu/?u=https%3A%2F%2Ftse1.mm.bing.net%2Fth%3Fid%3DOIP.AW-Mp587RarEZoyNCuYLuAHaFj%26pid%3DApi&f=1&ipt=2ff019820e1f4db1077639c8b6b012bbc8c68e55cf9cbe91b294aec8bc3d8e07&ipo=images
232,Mocha-brownies-358238,mocha brownies,5.0,5100.0,[Desserts],[American],"[brownies, unsweetened chocolate, butter, sugar, eggs, vanilla extract, all-purpose flour, icing, powdered sugar, cocoa powder, salt, coffee]","['browny', 'chocolate', 'butter', 'sugar', 'egg', 'vanilla extract', 'all purpose flmy', 'icing', 'sugar', 'cocoa powder', 'salt', 'coffee']",12,85.0,duckduckgo.com/iu/?u=https%3A%2F%2Ftse1.mm.bing.net%2Fth%3Fid%3DOIP.4BtAI0ymLBR1QsEkjAR2DQHaLH%26pid%3DApi&f=1&ipt=68099770c5656f001e6321b2e6ea3617a6bf631eec1db50bd80da57f5f29ea69&ipo=images
233,Roasted-spiced-sweet-potatoes-307230,roasted spiced sweet potatoes,5.0,2700.0,[Side Dishes],[American],"[coriander seeds, fennel seeds, dried oregano, hot red pepper flakes, kosher salt, sweet potatoes, vegetable oil]","['', '', 'oregano', 'pepper flake', 'kosher salt', 'sweet potato', 'vegetable oil']",7,45.0,duckduckgo.com/iu/?u=https%3A%2F%2Ftse3.mm.bing.net%2Fth%3Fid%3DOIF.ZC3neUs9LP9QlePMeByz5Q%26pid%3DApi&f=1&ipt=3315d81a8a5319f5851714ea90e397b6bf5be9b5c0d12bfd9ae3b2806f5858aa&ipo=images
234,Southern-Fried-Chicken-Allrecipes,southern fried chicken,5.0,2100.0,[Main Dishes],"[Southern & Soul Food, American]","[chicken, all-purpose flour, salt, ground black pepper, paprika, vegetable oil]","['chicken', 'all purpose flmy', 'salt', 'black pepper', 'paprika', 'vegetable oil']",6,35.0,duckduckgo.com/iu/?u=https%3A%2F%2Ftse2.mm.bing.net%2Fth%3Fid%3DOIP.fZdLV9RhvimRd2SxpjUpCQHaJc%26pid%3DApi&f=1&ipt=1be86bf35ed73940e42bb4bd1f5a04c8e5fc3d3d6408b29461d0de929d705e3a&ipo=images
235,Perfect-Mustard-Vinaigrette-Martha-Stewart,perfect mustard vinaigrette,4.0,900.0,[Salads],[American],"[dijon mustard, champagne vinegar, extra-virgin olive oil, coarse salt, freshly ground pepper]","['dijon mustard', 'champagne vinegar', 'extra virgin olive oil', 'coarse salt', 'pepper']",5,15.0,duckduckgo.com/iu/?u=https%3A%2F%2Ftse2.explicit.bing.net%2Fth%3Fid%3DOIP.-anJbXMsVJ4DDTxQLQG0_QHaHa%26pid%3DApi&f=1&ipt=f6041220ccee2cca2f7556ac7279d87a69b298b6ac437d1d634ce70dd464eef5&ipo=images
236,Brown_Sugar-Barbecue-Chicken-Drumettes-Martha-Stewart,brown-sugar barbecue chicken drumettes,4.0,2700.0,"[Appetizers, Main Dishes]","[American, Kid-Friendly]","[ketchup, light brown sugar, worcestershire sauce, cider vinegar, coarse salt, ground pepper, chicken wing drummettes]","['ketchup', 'light brown sugar', 'worcestershire sauce', 'cider vinegar', 'coarse salt', 'pepper', 'chicken wing drummette']",7,45.0,duckduckgo.com/iu/?u=https%3A%2F%2Ftse4.mm.bing.net%2Fth%3Fid%3DOIP.OsGXcBLUK7r7qrDYY9WhIQHaJQ%26pid%3DApi&f=1&ipt=807cfdc58462aa9dc5f5ca0b8ebcdbca5ba86239f2d8c96cc21d869d72172655&ipo=images
237,Peach-Lemonade-498006,peach lemonade,4.0,4800.0,[Beverages],[American],"[water, peaches, sugar, fresh lemon juice, ice]","['water', 'peach', 'sugar', 'lemon juice', 'ice']",5,80.0,duckduckgo.com/iu/?u=https%3A%2F%2Ftse2.mm.bing.net%2Fth%3Fid%3DOIP.4wTCuOcTgqj90yFFPxvDsgHaLG%26pid%3DApi&f=1&ipt=545e4e9d242806ab8fdc039b9ae67695513d4c6d58f6915a8a2819d8c42f6e18&ipo=images
238,Steak-diane-368659,steak diane,4.0,1500.0,[Main Dishes],"[American, French]","[filet, pepper, salt, extra-virgin olive oil, butter, shallots, dijon mustard, worcestershire sauce, heavy cream, lemon juice, chopped fresh chives]","['filet', 'pepper', 'salt', 'extra virgin olive oil', 'butter', 'shallot', 'dijon mustard', 'worcestershire sauce', 'heavy cream', 'lemon juice', 'chive']",11,25.0,duckduckgo.com/iu/?u=https%3A%2F%2Ftse1.mm.bing.net%2Fth%3Fid%3DOIP.6k8cNKbsNldgE4-rdZVZSgHaFj%26pid%3DApi&f=1&ipt=2d2a267727521d816c5b5ebac09b72d6d4d67ea2850c6ee79b40c7df6af9347b&ipo=images
239,Corn-and-black-bean-salsa-305811,corn and black bean salsa,5.0,3600.0,[Appetizers],[American],"[sweet corn, black beans, purple onion, garlic, jalapeno chilies, red bell pepper, chopped cilantro, ground cumin, olive oil, lime juice, salt, cayenne, bacon]","['sweet corn', 'black bean', 'purple onion', 'garlic', 'jalapeno chily', 'bell pepper', 'cilantro', 'cumin', 'olive oil', 'lime juice', 'salt', 'cayenne', 'bacon']",13,60.0,duckduckgo.com/iu/?u=https%3A%2F%2Ftse4.mm.bing.net%2Fth%3Fid%3DOIP.HVTUOp8WrrJCgl25r1FVLwHaLH%26pid%3DApi&f=1&ipt=ddd7a3e50702b343143e67b50b409b8550dcb145645ebf591d5f1dd140fda500&ipo=images
240,Spicy-oven-fries-296618,spicy oven fries,4.0,3600.0,[Side Dishes],[American],"[potatoes, country crock calcium plus vitamin d, salt, ground black pepper, cayenne pepper]","['potato', 'country crock calcium plu vitamin', 'salt', 'black pepper', 'cayenne pepper']",5,60.0,duckduckgo.com/iu/?u=https%3A%2F%2Ftse3.mm.bing.net%2Fth%3Fid%3DOIP.6k3qwnnsxHP4bI4g5c8dmAHaJ4%26pid%3DApi&f=1&ipt=22a76423ed5d719ee70071cc7591e3d61458c36efe413309f92ebdd14630aaf7&ipo=images
241,Jamie-369439,jamie,5.0,1500.0,,[American],"[freshly ground pepper, dill weed, reduced-fat sour cream, reduced fat mayonnaise, vidalia onion, flat leaf parsley]","['pepper', '', 'fat smy cream', 'fat mayonnaise', 'vidalium onion', 'flat leaf parsley']",6,25.0,duckduckgo.com/iu/?u=https%3A%2F%2Ftse4.mm.bing.net%2Fth%3Fid%3DOIP.eh-D2CMJFwtiWYi_NGxauAHaIy%26pid%3DApi&f=1&ipt=6bc5e6d41c30e4339723e2054d9367e09b9e6570b56ce7dd31cc206695989f24&ipo=images
242,Southern-cornbread-304976,southern cornbread,5.0,2100.0,[Breads],[Southern & Soul Food],"[flour, cornmeal, baking soda, salt, sugar, buttermilk, eggs, unsalted butter, bacon drippings]","['flmy', 'cornmeal', 'baking soda', 'salt', 'sugar', 'buttermilk', 'egg', 'butter', 'bacon dripping']",9,35.0,duckduckgo.com/iu/?u=https%3A%2F%2Ftse3.mm.bing.net%2Fth%3Fid%3DOIP.QpfJQMV_SkDxNT-eVJNFpgHaLJ%26pid%3DApi&f=1&ipt=9435d884dfe4990e919b64bfb471e89d0445d84eccf7ae8ab348b275084ecb9d&ipo=images
243,Mississippi-Mud-Cake-1164639,mississippi mud cake,4.0,3000.0,[Desserts],[American],"[melted butter, sugar, unsweetened cocoa powder, large eggs, vanilla extract, salt, all-purpose flour, chopped pecans, mini marshmallows, powdered sugar, milk, butter]","['butter', 'sugar', 'cocoa powder', 'egg', 'vanilla extract', 'salt', 'all purpose flmy', 'pecan', 'mini marshmallow', 'sugar', 'milk', 'butter']",12,50.0,duckduckgo.com/iu/?u=https%3A%2F%2Ftse1.mm.bing.net%2Fth%3Fid%3DOIP.jOzTykUDFnSOcViEhYLxzQHaLH%26pid%3DApi&f=1&ipt=1797fa4ad15058f4f7f6766536acf0f643df8d5d9d30e8fc481c5f0f3f18e444&ipo=images
244,Pineapple-Sorbet-474201,pineapple sorbet,5.0,4800.0,[Desserts],[American],"[pineapple, granulated sugar, water]","['pineapple', 'sugar', 'water']",3,80.0,duckduckgo.com/iu/?u=https%3A%2F%2Ftse1.mm.bing.net%2Fth%3Fid%3DOIP.De_z-y8X8pg87sSVpt-_SwHaKZ%26pid%3DApi&f=1&ipt=0cce738b93286506fab0dd3f949b49e7b7095e3774544acdec5616dcc701ed37&ipo=images
245,Southern-Pulled-Pork-Allrecipes,southern pulled pork,5.0,23400.0,[Main Dishes],"[Southern & Soul Food, American]","[butter, pork roast, cajun seasoning, onions, garlic, water, flavoring]","['butter', 'pork roast', 'cajun seasoning', 'onion', 'garlic', 'water', 'flavoring']",7,390.0,duckduckgo.com/iu/?u=https%3A%2F%2Ftse3.mm.bing.net%2Fth%3Fid%3DOIP.pDhB8-3mMFQgkIBWxUk6SgHaIs%26pid%3DApi&f=1&ipt=f74849cebfa02a8b604ae2dc156a5baf49314054710034b98f943318b9fcbbc8&ipo=images
246,Brown-sugar-butterscotch-slice-and-bake-cookies-346051,brown sugar-butterscotch slice-and-bake cookies,5.0,5400.0,[Desserts],[American],"[unsalted butter, dark brown sugar, vanilla extract, salt, candy, white flour]","['butter', 'dark brown sugar', 'vanilla extract', 'salt', 'candy', 'white flmy']",6,90.0,duckduckgo.com/iu/?u=https%3A%2F%2Ftse4.mm.bing.net%2Fth%3Fid%3DOIP._dj33ygiKhI0hd-kJWdg2gAAAA%26pid%3DApi&f=1&ipt=bbebaf36c9ad6fef00fcaecdf8aff07f7c008dcb25a4e8e6f34b77ec2bee23f7&ipo=images
247,Raspberry-Sparklers-MyRecipes-244874,raspberry sparklers,3.0,1200.0,[Beverages],[American],"[raspberries, lemon juice, sugar, ice cubes, seltzer, mint sprigs]","['raspberry', 'lemon juice', 'sugar', 'ice cube', 'seltzer', 'mint sprig']",6,20.0,duckduckgo.com/iu/?u=https%3A%2F%2Ftse4.mm.bing.net%2Fth%3Fid%3DOIP.B8gq9mG1j5JW6R9RGJucggHaLH%26pid%3DApi&f=1&ipt=1444bbcea161d9ec7cbf1e0cdd567dc0f1f3e10f62e1265c9255f30a663749e5&ipo=images
248,Tartar-Sauce-Martha-Stewart-191213,tartar sauce,3.0,1500.0,[Condiments and Sauces],[American],"[mayonnaise, sweet relish, capers, fresh lemon juice, hot pepper sauce]","['mayonnaise', 'sweet relish', 'caper', 'lemon juice', 'hot pepper sauce']",5,25.0,duckduckgo.com/iu/?u=https%3A%2F%2Ftse1.mm.bing.net%2Fth%3Fid%3DOIP.o9kXyYouU7WWrpn8Du5llgHaHa%26pid%3DApi&f=1&ipt=fb3a4697f21e141594a01a1f4e96a9428070d2db1292f2ef47f0e98a3c7138d2&ipo=images
249,Twice-baked-potatoes-with-ham-298386,twice-baked potatoes with ham,4.0,2400.0,[Side Dishes],[American],"[baking potatoes, hellmann' or best food real mayonnais, shredded cheddar cheese, cooked ham, sour cream]","['baking potato', 'hellmann best food real mayonnai', 'dar cheese', 'ham', 'smy cream']",5,40.0,duckduckgo.com/iu/?u=https%3A%2F%2Ftse3.mm.bing.net%2Fth%3Fid%3DOIP.Cl-lL0eEcnxOFQTyz0SbCAHaLH%26pid%3DApi&f=1&ipt=f406ef69ea8993793e14425c66bbdcb8592177bb391d8270aabcfdfe3dc358f6&ipo=images
250,Huevos-rancheros-352493,huevos rancheros,5.0,,"[Breakfast and Brunch, Lunch and Snacks]","[American, Mexican, Southwestern]","[oil, onions, tomatoes, green chile, pepper, salt, cumin, large eggs, shredded lettuce, cheese, chopped cilantro, olive oil spray, corn tortillas]","['oil', 'onion', 'tomato', 'chile', 'pepper', 'salt', 'cumin', 'egg', 'lettuce', 'cheese', 'cilantro', 'olive oil spray', 'corn tortilla']",13,,duckduckgo.com/iu/?u=https%3A%2F%2Ftse3.mm.bing.net%2Fth%3Fid%3DOIP.N34bg77IWCQCi-wErPmKxQHaEv%26pid%3DApi&f=1&ipt=aaf40ce0bbe8501fd350f54611e6b6ebd6d213e3a84803801eb6ad2256781748&ipo=images
251,Blue-Cheese-Vinaigrette-Martha-Stewart,blue cheese vinaigrette,3.0,300.0,[Salads],[American],"[white wine vinegar, dijon mustard, coarse salt, ground pepper, sugar, extra-virgin olive oil, crumbled blue cheese]","['white wine vinegar', 'dijon mustard', 'coarse salt', 'pepper', 'sugar', 'extra virgin olive oil', 'blue cheese']",7,5.0,duckduckgo.com/iu/?u=https%3A%2F%2Ftse3.mm.bing.net%2Fth%3Fid%3DOIP.rBxHA49Mpg6f1TNncAxYcQHaE8%26pid%3DApi&f=1&ipt=882d6507f51961aa92cead83fd01935ee4ea1d276a64f190b70438f0c25e609c&ipo=images
252,Artichoke-Dip-497388,artichoke dip,4.0,3300.0,"[Appetizers, Lunch and Snacks]",[American],"[artichoke hearts, hot sauce, lemon juice, garlic powder, mayonnaise, parmesan cheese, daisy sour cream]","['artichoke heart', 'hot sauce', 'lemon juice', 'garlic powder', 'mayonnaise', 'parmesan cheese', 'daisy smy cream']",7,55.0,duckduckgo.com/iu/?u=https%3A%2F%2Ftse4.mm.bing.net%2Fth%3Fid%3DOIP._9G-nI-swIRMSjYR0ftrCAHaLL%26pid%3DApi&f=1&ipt=59151b171208bd65ef8638ae75fc4a2bced6566d70ee082dbab1d81c5a9afb62&ipo=images
253,Brown-Gravy-My-Recipes_1,brown gravy,4.0,1500.0,"[Side Dishes, Condiments and Sauces]",[American],"[all-purpose flour, degreased turkey drippings, water, dry red wine, ground red pepper, black pepper]","['all purpose flmy', 'turkey dripping', 'water', 'wine', 'pepper', 'black pepper']",6,25.0,duckduckgo.com/iu/?u=https%3A%2F%2Ftse4.mm.bing.net%2Fth%3Fid%3DOIP.ubsqs--553xbFd9SN6K-JAHaLH%26pid%3DApi&f=1&ipt=dacdb53d30e1f113c5ab4bca5afc60c4c4ea7c6f10a3649643eb38889a3eacae&ipo=images
254,Italian-potato-salad-297346,italian potato salad,4.0,1500.0,"[Salads, Side Dishes]","[American, Italian]","[potatoes, wish-bone italian dressing, hellmann' or best food real mayonnais, finely chopped fresh parsley, red bell pepper, pitted olives, black pepper]","['potato', 'wish bone italian dressing', 'hellmann best food real mayonnai', 'parsley', 'bell pepper', 'olife', 'black pepper']",7,25.0,duckduckgo.com/iu/?u=https%3A%2F%2Ftse3.mm.bing.net%2Fth%3Fid%3DOIP.U6mj7DVv82l8EJFfpDyJoAHaLH%26pid%3DApi&f=1&ipt=b1acc069c53ec989c4210605c8bc61e68b2f9955f4fb6d83d4cc4be78ac13761&ipo=images
255,Banana-apricot-turnovers-352265,banana apricot turnovers,5.0,2400.0,[Desserts],[American],"[pepperidge farm puff pastry sheets, bananas, apricot preserves, cooking spray]","['pepperidge farm puff pastry sheet', 'banana', 'apricot preserve', 'cooking spray']",4,40.0,duckduckgo.com/iu/?u=https%3A%2F%2Ftse2.mm.bing.net%2Fth%3Fid%3DOIP.dJBXcWNO6Qo7nUJgdeHd1wHaE8%26pid%3DApi&f=1&ipt=82e36c1ea95a65fa484a35b4dfe7d6f0f916962138b9a1ee43300feec3ff7bf4&ipo=images
256,Roasted-Red-Potatoes-Martha-Stewart,roasted red potatoes,4.0,2100.0,[Side Dishes],[American],"[red potato, olive oil, fresh rosemary, freshly ground pepper, coarse salt]","['potato', 'olive oil', 'rosemary', 'pepper', 'coarse salt']",5,35.0,duckduckgo.com/iu/?u=https%3A%2F%2Ftse4.mm.bing.net%2Fth%3Fid%3DOIP.uNw8IFpAaBebSbDMr7_Y2gHaLH%26pid%3DApi&f=1&ipt=3032bae43320fb94dd6dfc61cd269ad01475180d42506478987c69d924c294e2&ipo=images
257,Smashed-potatoes-299078,smashed potatoes,4.0,1800.0,[Side Dishes],"[American, French]","[red potato, hellmann' or best food real mayonnais, grated parmesan cheese, sliced green onions, garlic]","['potato', 'hellmann best food real mayonnai', 'parmesan cheese', 'onion', 'garlic']",5,30.0,duckduckgo.com/iu/?u=https%3A%2F%2Ftse3.mm.bing.net%2Fth%3Fid%3DOIP.3n4Ga7kZg6cnSqeVyqiANgHaLH%26pid%3DApi&f=1&ipt=8322452eb09e47e01ebfd7a522c0e3b1503140d3d06139ee45e78a1d4d12e066&ipo=images
258,Baked-artichoke-dip-308882,baked artichoke dip,5.0,3900.0,[Appetizers],[American],"[water, silken tofu, garlic, parmesan cheese, greek yogurt, salt, cayenne pepper]","['water', 'silken tofu', 'garlic', 'parmesan cheese', 'greek yogurt', 'salt', 'cayenne pepper']",7,65.0,duckduckgo.com/iu/?u=https%3A%2F%2Ftse1.mm.bing.net%2Fth%3Fid%3DOIP.UmqdDpRzt2Glq4ab8oBkrQHaLH%26pid%3DApi&f=1&ipt=a36656d58fdeb4015b8e7c66050b57ab8cde6858a01b0fa3d4a3b20c31b09c18&ipo=images
